NsiI.TP554788,"Sobic.001G077300.3;37940787;Sobic.001G077300;Sobic.001G077300.3;Sobic.001G077300.3.p;PF00085;PTHR10438,PTHR10438:SF272;NONE;NONE;NONE;GO:0045454,GO:0015035,GO:0006662;AT4G37200.1;HCF164;Thioredoxin superfamily protein;LOC_Os03g55820.1;NA;thioredoxin, putative, expressed ","Sobic.001G077300.1;37940786;Sobic.001G077300;Sobic.001G077300.1;Sobic.001G077300.1.p;PF00085;PTHR10438,PTHR10438:SF272;KOG0907;5.3.4.1;NONE;GO:0045454,GO:0015035,GO:0006662;AT4G37200.1;HCF164;Thioredoxin superfamily protein;LOC_Os03g55820.1;NA;thioredoxin, putative, expressed ","Sobic.001G077300.2;37940788;Sobic.001G077300;Sobic.001G077300.2;Sobic.001G077300.2.p;PF00085;PTHR10438,PTHR10438:SF272;NONE;5.3.4.1;NONE;GO:0045454,GO:0015035,GO:0006662;AT4G37200.1;HCF164;Thioredoxin superfamily protein;LOC_Os03g55820.1;NA;thioredoxin, putative, expressed ","Sobic.001G077400.1;37937430;Sobic.001G077400;Sobic.001G077400.1;Sobic.001G077400.1.p;PF00067;PTHR24286,PTHR24286:SF57;NONE;4.2.1.92;K01723;GO:0055114,GO:0020037,GO:0016705,GO:0005506;AT5G42650.1;AOS,CYP74A,DDE2;allene oxide synthase;LOC_Os03g55800.1;NA;cytochrome P450, putative, expressed ","Sobic.001G077200.1;37941569;Sobic.001G077200;Sobic.001G077200.1;Sobic.001G077200.1.p;PF00651,PF03000;PTHR32370,PTHR32370:SF8;NONE;NONE;NONE;GO:0005515;AT5G66560.1;NONE;Phototropic-responsive NPH3 family protein;LOC_Os03g55830.1;NA;BTBN10 - Bric-a-Brac, Tramtrack, Broad Complex BTB domain with non-phototropic hypocotyl 3 NPH3 and coiled-coil domains, expressed ","Sobic.001G077200.2;37941570;Sobic.001G077200;Sobic.001G077200.2;Sobic.001G077200.2.p;PF03000;PTHR32370,PTHR32370:SF8;NONE;NONE;NONE;NONE;AT5G66560.1;NONE;Phototropic-responsive NPH3 family protein;LOC_Os03g55830.1;NA;BTBN10 - Bric-a-Brac, Tramtrack, Broad Complex BTB domain with non-phototropic hypocotyl 3 NPH3 and coiled-coil domains, expressed ","Sobic.001G077500.2;37941143;Sobic.001G077500;Sobic.001G077500.2;Sobic.001G077500.2.p;PF09754;PTHR12970;KOG3112;NONE;K11876;NONE;AT3G18940.1;NONE;clast3-related;LOC_Os03g55784.1;NA;tumor necrosis factor superfamily, member 5-induced protein 1, putative, expressed ", , , , , , , , 
NsiI.TP571744,"Sobic.002G031400.2;37953448;Sobic.002G031400;Sobic.002G031400.2;Sobic.002G031400.2.p;NONE;PTHR32212;NONE;NONE;NONE;NONE;AT5G03100.1;NONE;F-box/RNI-like superfamily protein;LOC_Os07g26000.1;NA;OsFBX235 - F-box domain containing protein, expressed ","Sobic.002G031400.3;37953447;Sobic.002G031400;Sobic.002G031400.3;Sobic.002G031400.3.p;NONE;PTHR32212,PTHR32212:SF74;NONE;NONE;NONE;NONE;AT1G13570.1;NONE;F-box/RNI-like superfamily protein;LOC_Os07g26000.1;NA;OsFBX235 - F-box domain containing protein, expressed ","Sobic.002G031400.1;37953446;Sobic.002G031400;Sobic.002G031400.1;Sobic.002G031400.1.p;NONE;PTHR32212,PTHR32212:SF74;NONE;NONE;NONE;NONE;AT1G13570.1;NONE;F-box/RNI-like superfamily protein;LOC_Os07g26000.1;NA;OsFBX235 - F-box domain containing protein, expressed ","Sobic.002G031500.1;37951670;Sobic.002G031500;Sobic.002G031500.1;Sobic.002G031500.1.p;NONE;PTHR32212,PTHR32212:SF74;NONE;NONE;NONE;NONE;AT1G13570.1;NONE;F-box/RNI-like superfamily protein;LOC_Os07g06900.1;NA;OsFBLD3 - F-box, LRR and FBD domain containing protein, expressed ","Sobic.002G031500.2;37951671;Sobic.002G031500;Sobic.002G031500.2;Sobic.002G031500.2.p;NONE;PTHR32212,PTHR32212:SF74;NONE;NONE;NONE;NONE;AT3G58880.1;NONE;F-box/RNI-like superfamily protein;LOC_Os11g33310.1;NA;OsFBX424 - F-box domain containing protein, expressed ","Sobic.002G031500.3;37951672;Sobic.002G031500;Sobic.002G031500.3;Sobic.002G031500.3.p;NONE;PTHR32212,PTHR32212:SF74;NONE;NONE;NONE;NONE;AT3G58880.1;NONE;F-box/RNI-like superfamily protein;LOC_Os11g33310.1;NA;OsFBX424 - F-box domain containing protein, expressed ", , , , , , , , , 
NsiI.TP57283,"Sobic.006G130800.1;37947760;Sobic.006G130800;Sobic.006G130800.1;Sobic.006G130800.1.p;PF07690;PTHR24064,PTHR24064:SF113;KOG0254;NONE;K08150;GO:0055085,GO:0016021;AT2G43330.1;ATINT1,INT1;inositol transporter 1;LOC_Os04g41460.1;NA;transporter family protein, putative, expressed ", , , , , , , , , , , , , , 
NsiI.TP575555,"Sobic.002G023900.1;37949963;Sobic.002G023900;Sobic.002G023900.1;Sobic.002G023900.1.p;PF03789,PF05920,PF03790,PF03791;PTHR11850,PTHR11850:SF110;KOG0773;NONE;NONE;GO:0003677,GO:0006355,GO:0005634;AT4G08150.1;BP,BP1,KNAT1;KNOTTED-like from Arabidopsis thaliana;LOC_Os07g03770.1;NA;Homeobox domain containing protein, expressed ", , , , , , , , , , , , , , 
NsiI.TP575618,"Sobic.007G039100.1;37934558;Sobic.007G039100;Sobic.007G039100.1;Sobic.007G039100.1.p;PF00249;PTHR10641,PTHR10641:SF451;NONE;NONE;K09422;NONE;AT1G63910.1;AtMYB103,MYB103;myb domain protein 103;LOC_Os08g05520.1;NA;myb-like DNA-binding domain containing protein, putative, expressed ","Sobic.007G039200.1;37937255;Sobic.007G039200;Sobic.007G039200.1;Sobic.007G039200.1.p;PF00249;PTHR24078,PTHR24078:SF169;NONE;NONE;NONE;NONE;AT5G61620.1;NONE;myb-like transcription factor family protein;LOC_Os08g05510.1;NA;MYB family transcription factor, putative, expressed ","Sobic.007G039200.2;37937257;Sobic.007G039200;Sobic.007G039200.2;Sobic.007G039200.2.p;PF00249;PTHR24078,PTHR24078:SF169;NONE;NONE;NONE;NONE;AT5G61620.1;NONE;myb-like transcription factor family protein;LOC_Os08g05510.2;NA;MYB family transcription factor, putative, expressed ","Sobic.007G039200.3;37937256;Sobic.007G039200;Sobic.007G039200.3;Sobic.007G039200.3.p;PF00249;PTHR24078,PTHR24078:SF169;NONE;NONE;NONE;NONE;AT5G47390.1;NONE;myb-like transcription factor family protein;LOC_Os08g05510.1;NA;MYB family transcription factor, putative, expressed ", , , , , , , , , , , 
NsiI.TP575744,"Sobic.001G380400.1;37942050;Sobic.001G380400;Sobic.001G380400.1;Sobic.001G380400.1.p;PF02453;PTHR10994,PTHR10994:SF67;KOG1792;NONE;NONE;NONE;AT3G10915.2;NONE;Reticulon family protein;LOC_Os03g21840.1;NA;reticulon domain containing protein, putative, expressed ","Sobic.001G380200.3;37941045;Sobic.001G380200;Sobic.001G380200.3;Sobic.001G380200.3.p;NONE;PTHR23092,PTHR23092:SF29;NONE;NONE;NONE;NONE;AT3G51620.2;NONE;PAP/OAS1 substrate-binding domain superfamily;LOC_Os03g21850.1;NA;nucleotidyltransferase, putative, expressed ","Sobic.001G380200.2;37941044;Sobic.001G380200;Sobic.001G380200.2;Sobic.001G380200.2.p;NONE;PTHR23092,PTHR23092:SF29;NONE;2.7.7.19;NONE;NONE;AT3G51620.2;NONE;PAP/OAS1 substrate-binding domain superfamily;LOC_Os03g21850.1;NA;nucleotidyltransferase, putative, expressed ","Sobic.001G380200.1;37941043;Sobic.001G380200;Sobic.001G380200.1;Sobic.001G380200.1.p;NONE;PTHR23092,PTHR23092:SF29;NONE;2.7.7.19;NONE;NONE;AT3G51620.2;NONE;PAP/OAS1 substrate-binding domain superfamily;LOC_Os03g21850.1;NA;nucleotidyltransferase, putative, expressed ","Sobic.001G380500.1;37937806;Sobic.001G380500;Sobic.001G380500.1;Sobic.001G380500.1.p;PF01661;PTHR11106;KOG2633;NONE;NONE;NONE;AT2G40600.1;NONE;appr-1-p processing enzyme family protein;LOC_Os03g21830.1;NA;appr-1-p processing enzyme family protein, putative, expressed ", , , , , , , , , , 
NsiI.TP579169,"Sobic.007G110900.1;37935203;Sobic.007G110900;Sobic.007G110900.1;Sobic.007G110900.1.p;NONE;PTHR34116,PTHR34116:SF3;NONE;NONE;NONE;NONE;AT1G57680.1;NONE;NONE;LOC_Os08g25830.1;NA;expressed protein ", , , , , , , , , , , , , , 
NsiI.TP579718,"Sobic.003G319900.1;37916589;Sobic.003G319900;Sobic.003G319900.1;Sobic.003G319900.1.p;PF03321;PTHR31901,PTHR31901:SF8;NONE;NONE;K14487;NONE;AT5G54510.1;DFL1,GH3.6;Auxin-responsive GH3 family protein;LOC_Os01g57610.1;NA;OsGH3.1 - Probable indole-3-acetic acid-amido synthetase, expressed ","Sobic.003G320100.1;37916257;Sobic.003G320100;Sobic.003G320100.1;Sobic.003G320100.1.p;PF13041;PTHR24015,PTHR24015:SF893;NONE;NONE;NONE;NONE;AT1G55890.1;NONE;Tetratricopeptide repeat (TPR)-like superfamily protein;LOC_Os01g57630.3;NA;pentatricopeptide containing protein, putative, expressed ","Sobic.003G320000.1;37915840;Sobic.003G320000;Sobic.003G320000.1;Sobic.003G320000.1.p;PF08241;PTHR10108,PTHR10108:SF914;NONE;2.1.1.95;NONE;GO:0008168,GO:0008152;AT2G16030.1;NONE;S-adenosyl-L-methionine-dependent methyltransferases superfamily protein;LOC_Os01g57620.1;NA;expressed protein ", , , , , , , , , , , , 
NsiI.TP579782,"Sobic.003G300100.1;37912951;Sobic.003G300100;Sobic.003G300100.1;Sobic.003G300100.1.p;PF00170;PTHR13301,PTHR13301:SF48;NONE;NONE;NONE;GO:0043565,GO:0006355,GO:0003700;AT2G42380.2;ATBZIP34,BZIP34;Basic-leucine zipper (bZIP) transcription factor family protein;LOC_Os01g55150.1;NA;bZIP transcription factor domain containing protein, expressed ","Sobic.003G300000.1;37913023;Sobic.003G300000;Sobic.003G300000.1;Sobic.003G300000.1.p;NONE;PTHR35120,PTHR35120:SF1;NONE;NONE;NONE;NONE;AT2G42370.1;NONE;NONE;LOC_Os01g55120.1;NA;expressed protein ","Sobic.003G300000.2;37913024;Sobic.003G300000;Sobic.003G300000.2;Sobic.003G300000.2.p;NONE;PTHR35120,PTHR35120:SF1;NONE;NONE;NONE;NONE;AT2G42370.1;NONE;NONE;LOC_Os01g55120.1;NA;expressed protein ", , , , , , , , , , , , 
NsiI.TP592207,"Sobic.005G138900.1;37925464;Sobic.005G138900;Sobic.005G138900.1;Sobic.005G138900.1.p;PF01529;PTHR22883,PTHR22883:SF60;KOG1311;2.3.1.225;K16675;GO:0008270;AT3G26935.1;NONE;DHHC-type zinc finger family protein;LOC_Os11g32960.1;NA;zinc finger DHHC domain-containing protein, putative, expressed ", , , , , , , , , , , , , , 
NsiI.TP597273,Sobic.004G197700.1;37928980;Sobic.004G197700;Sobic.004G197700.1;Sobic.004G197700.1.p;NONE;PTHR36342;NONE;NONE;NONE;NONE;AT2G04790.2;NONE;NONE;LOC_Os02g37600.1;NA;expressed protein , , , , , , , , , , , , , , 
NsiI.TP602190,"Sobic.002G321200.1;37954553;Sobic.002G321200;Sobic.002G321200.1;Sobic.002G321200.1.p;PF00931;PTHR23155,PTHR23155:SF636;KOG4658;NONE;NONE;GO:0043531;AT3G14470.1;NONE;NB-ARC domain-containing disease resistance protein;LOC_Os07g33740.1;NA;vrga1, putative, expressed ","Sobic.002G321300.1;37954798;Sobic.002G321300;Sobic.002G321300.1;Sobic.002G321300.1.p;PF14510,PF08370,PF00005,PF01061;PTHR19241,PTHR19241:SF307;NONE;3.6.3.44;NONE;GO:0016887,GO:0005524,GO:0016020;AT2G36380.1;ATPDR6,PDR6;pleiotropic drug resistance 6;LOC_Os11g37700.1;NA;pleiotropic drug resistance protein, putative, expressed ","Sobic.002G321100.1;37951892;Sobic.002G321100;Sobic.002G321100.1;Sobic.002G321100.1.p;PF00931;PTHR23155,PTHR23155:SF589;NONE;NONE;NONE;GO:0043531;AT3G14470.1;NONE;NB-ARC domain-containing disease resistance protein;LOC_Os07g33730.2;NA;NB-ARC domain containing protein, expressed ","Sobic.002G321100.2;37951893;Sobic.002G321100;Sobic.002G321100.2;Sobic.002G321100.2.p;PF00931;PTHR23155,PTHR23155:SF589;KOG4658;NONE;NONE;GO:0043531;AT3G14470.1;NONE;NB-ARC domain-containing disease resistance protein;LOC_Os07g33730.2;NA;NB-ARC domain containing protein, expressed ", , , , , , , , , , , 
NsiI.TP607068,"Sobic.008G019400.1;37928065;Sobic.008G019400;Sobic.008G019400.1;Sobic.008G019400.1.p;PF01554;PTHR11206,PTHR11206:SF102;KOG1347;NONE;K03327;GO:0055085,GO:0016020,GO:0015297,GO:0015238,GO:0006855;AT1G33110.1;NONE;MATE efflux family protein;LOC_Os11g03240.1;NA;MATE efflux family protein, putative, expressed ","Sobic.008G019532.1;37928274;Sobic.008G019532;Sobic.008G019532.1;Sobic.008G019532.1.p;PF00742;PTHR21499,PTHR21499:SF33;KOG0455;1.1.1.3;NONE;GO:0055114,GO:0006520;AT5G21060.2;NONE;Glyceraldehyde-3-phosphate dehydrogenase-like family protein;LOC_Os11g03470.1;NA;bifunctional aspartokinase/homoserine dehydrogenase, putative, expressed ","Sobic.008G019600.1;37928013;Sobic.008G019600;Sobic.008G019600.1;Sobic.008G019600.1.p;PF08311;PTHR14030,PTHR14030:SF2;NONE;NONE;NONE;GO:0007094;AT5G05510.1;NONE;Mad3/BUB1 homology region 1;LOC_Os11g03460.1;NA;Mad3/BUB1 homology region 1 domain containing protein, expressed ", , , , , , , , , , , , 
NsiI.TP607427,"Sobic.001G446800.1;37942851;Sobic.001G446800;Sobic.001G446800.1;Sobic.001G446800.1.p;PF01554;PTHR11206,PTHR11206:SF92;KOG1347;NONE;K03327;GO:0055085,GO:0016020,GO:0015297,GO:0015238,GO:0006855;AT1G58340.1;ZF14;MATE efflux family protein;LOC_Os03g12790.1;NA;MATE efflux family protein, putative, expressed ","Sobic.001G446900.1;37938971;Sobic.001G446900;Sobic.001G446900.1;Sobic.001G446900.1.p;NONE;PTHR11956,PTHR11956:SF5;NONE;6.1.1.19;NONE;GO:0006420,GO:0005524,GO:0004814;AT1G66530.1;NONE;Arginyl-tRNA synthetase, class Ic;LOC_Os05g07030.1;NA;arginyl-tRNA synthetase, putative, expressed ", , , , , , , , , , , , , 
NsiI.TP608930,"Sobic.004G203700.1;37931718;Sobic.004G203700;Sobic.004G203700.1;Sobic.004G203700.1.p;PF00240;PTHR10666,PTHR10666:SF127;NONE;NONE;NONE;GO:0005515;AT5G14360.1;NONE;Ubiquitin-like superfamily protein;LOC_Os02g38410.1;NA;ubiquitin family protein, putative, expressed ","Sobic.004G203800.1;37931583;Sobic.004G203800;Sobic.004G203800.1;Sobic.004G203800.1.p;NONE;PTHR31133,PTHR31133:SF6;NONE;NONE;NONE;NONE;AT5G40640.1;NONE;NONE;LOC_Os02g38430.1;NA;steroid nuclear receptor, ligand-binding, putative, expressed ","Sobic.004G203900.1;37929745;Sobic.004G203900;Sobic.004G203900.1;Sobic.004G203900.1.p;PF13561;PTHR24322,PTHR24322:SF591;KOG1014;1.1.1.330;K10251;NONE;AT1G67730.1;ATKCR1,KCR1,YBR159;beta-ketoacyl reductase 1;LOC_Os02g38440.1;NA;oxidoreductase, short chain dehydrogenase/reductase family, putative, expressed ", , , , , , , , , , , , 
NsiI.TP614958,"Sobic.006G087100.1;37947524;Sobic.006G087100;Sobic.006G087100.1;Sobic.006G087100.1.p;NONE;PTHR12675,PTHR12675:SF5;NONE;NONE;K14943;NONE;AT1G21580.1;NONE;Zinc finger C-x8-C-x5-C-x3-H type family protein;LOC_Os04g35800.1;NA;zinc finger C-x8-C-x5-C-x3-H type family protein, expressed ","Sobic.006G087200.1;37945897;Sobic.006G087200;Sobic.006G087200.1;Sobic.006G087200.1.p;PF08718;PTHR10219,PTHR10219:SF34;KOG3221;NONE;NONE;GO:0051861,GO:0046836,GO:0017089,GO:0005737;AT3G21260.3;GLTP3;Glycolipid transfer protein (GLTP) family protein;LOC_Os04g35790.3;NA;GLTP domain containing protein, putative, expressed ","Sobic.006G087300.1;37948461;Sobic.006G087300;Sobic.006G087300.1;Sobic.006G087300.1.p;PF13202,PF13833;PTHR10891,PTHR10891:SF613;KOG0027;NONE;K13448;GO:0005509;AT5G42380.1;CML37,CML39;calmodulin like 37;LOC_Os01g72530.1;NA;OsCML31 - Calmodulin-related calcium sensor protein, expressed ", , , , , , , , , , , , 
NsiI.TP615883,"Sobic.006G211500.1;37948166;Sobic.006G211500;Sobic.006G211500.1;Sobic.006G211500.1.p;PF03936,PF01397;PTHR31739:SF5,PTHR31739;NONE;4.2.3.19;K04121;GO:0000287,GO:0008152,GO:0010333,GO:0016829;AT1G79460.1;ATKS,ATKS1,GA2,KS,KS1;Terpenoid cyclases/Protein prenyltransferases superfamily protein;LOC_Os04g52230.1;NA;ent-kaurene synthase, chloroplast precursor, putative, expressed ","Sobic.006G211500.2;37948167;Sobic.006G211500;Sobic.006G211500.2;Sobic.006G211500.2.p;PF03936,PF01397;PTHR31739:SF5,PTHR31739;NONE;4.2.3.19;K04121;GO:0000287,GO:0008152,GO:0010333,GO:0016829;AT1G79460.1;ATKS,ATKS1,GA2,KS,KS1;Terpenoid cyclases/Protein prenyltransferases superfamily protein;LOC_Os04g52230.1;NA;ent-kaurene synthase, chloroplast precursor, putative, expressed ","Sobic.006G211701.1;37947473;Sobic.006G211701;Sobic.006G211701.1;Sobic.006G211701.1.p;PF14547;PTHR31731,PTHR31731:SF16;NONE;NONE;NONE;NONE;AT3G22142.1;NONE;Bifunctional inhibitor/lipid-transfer protein/seed storage 2S albumin superfamily protein;LOC_Os04g52260.1;NA;LTPL124 - Protease inhibitor/seed storage/LTP family protein precursor, expressed ","Sobic.006G211600.1;37947580;Sobic.006G211600;Sobic.006G211600.1;Sobic.006G211600.1.p;PF07983;PTHR32227,PTHR32227:SF104;NONE;NONE;NONE;NONE;AT1G79480.1;NONE;Carbohydrate-binding X8 domain superfamily protein;LOC_Os09g38784.1;NA;retrotransposon protein, putative, unclassified, expressed ","Sobic.006G211800.1;37949435;Sobic.006G211800;Sobic.006G211800.1;Sobic.006G211800.1.p;PF04733;PTHR10805,PTHR10805:SF1;KOG3081;NONE;K17268;GO:0006890,GO:0005198;AT1G30630.1;NONE;Coatomer epsilon subunit;LOC_Os04g52270.1;NA;coatomer subunit epsilon, putative, expressed ", , , , , , , , , , 
NsiI.TP619101,"Sobic.007G038366.1;37936132;Sobic.007G038366;Sobic.007G038366.1;Sobic.007G038366.1.p;PF04578,PF13968;PTHR31325,PTHR31325:SF39;NONE;NONE;NONE;NONE;AT5G45540.1;NONE;Protein of unknown function (DUF594);LOC_Os07g16600.1;NA;expressed protein ","Sobic.007G038432.1;37934683;Sobic.007G038432;Sobic.007G038432.1;Sobic.007G038432.1.p;PF04578,PF13968;PTHR31325,PTHR31325:SF39;NONE;NONE;NONE;NONE;AT5G45530.1;NONE;Protein of unknown function (DUF594);LOC_Os07g16600.1;NA;expressed protein ","Sobic.007G038300.1;37936762;Sobic.007G038300;Sobic.007G038300.1;Sobic.007G038300.1.p;NONE;PTHR32467,PTHR32467:SF8;NONE;NONE;K09285;GO:0007275,GO:0006355,GO:0003700;AT5G57390.1;AIL5,CHO1,EMK;AINTEGUMENTA-like 5;LOC_Os03g07940.1;NA;AP2 domain containing protein, expressed ","Sobic.007G038500.1;37934356;Sobic.007G038500;Sobic.007G038500.1;Sobic.007G038500.1.p;PF00230;PTHR19139,PTHR19139:SF166;KOG0223;NONE;K09874;GO:0016020,GO:0006810,GO:0005215;AT4G10380.1;NIP5_1,NLM6,NLM8;NOD26-like intrinsic protein 5_1;LOC_Os08g05580.1;NA;aquaporin protein, putative, expressed ","Sobic.007G038600.1;37937190;Sobic.007G038600;Sobic.007G038600.1;Sobic.007G038600.1.p;PF00070;PTHR22912,PTHR22912:SF97;KOG1336;1.6.5.4;K08232;GO:0055114,GO:0016491;AT1G63940.2;MDAR6;monodehydroascorbate reductase 6;LOC_Os08g05570.3;NA;monodehydroascorbate reductase, putative, expressed ","Sobic.007G038700.1;37937212;Sobic.007G038700;Sobic.007G038700.1;Sobic.007G038700.1.p;PF13639;PTHR22937,PTHR22937:SF6;NONE;NONE;K11985;GO:0008270,GO:0005515;AT4G01270.1;NONE;RING/U-box superfamily protein;LOC_Os08g05560.1;NA;zinc finger, C3HC4 type domain containing protein, expressed ", , , , , , , , , 
NsiI.TP620135,"Sobic.003G154500.1;37917053;Sobic.003G154500;Sobic.003G154500.1;Sobic.003G154500.1.p;NONE;PTHR33124,PTHR33124:SF13;NONE;NONE;NONE;NONE;AT2G47270.1;NONE;sequence-specific DNA binding transcription factors_transcription regulators;LOC_Os05g06520.1;NA;helix-loop-helix DNA-binding domain containing protein, expressed ", , , , , , , , , , , , , , 
NsiI.TP621902,"Sobic.007G197500.1;37935106;Sobic.007G197500;Sobic.007G197500.1;Sobic.007G197500.1.p;PF16851;PTHR37239,PTHR37239:SF1;NONE;NONE;NONE;NONE;AT4G12970.1;EPFL9,STOMAGEN;stomagen;LOC_Os08g41360.1;NA;expressed protein ","Sobic.007G197600.1;37935410;Sobic.007G197600;Sobic.007G197600.1;Sobic.007G197600.1.p;PF00025;PTHR24073,PTHR24073:SF394;KOG0087;NONE;K07904;GO:0005525;AT2G43130.1;ARA-4,ARA4,ATRAB11F,ATRABA5C,RABA5C;P-loop containing nucleoside triphosphate hydrolases superfamily protein;LOC_Os08g41340.1;NA;ras-related protein, putative, expressed ","Sobic.007G197400.1;37935483;Sobic.007G197400;Sobic.007G197400.1;Sobic.007G197400.1.p;PF01535,PF13041;PTHR24015,PTHR24015:SF503;NONE;NONE;NONE;NONE;AT5G18390.1;NONE;Pentatricopeptide repeat (PPR) superfamily protein;LOC_Os08g41380.1;NA;pentatricopeptide, putative, expressed ", , , , , , , , , , , , 
NsiI.TP632002,"Sobic.001G429600.1;37937877;Sobic.001G429600;Sobic.001G429600.1;Sobic.001G429600.1.p;PF03810,PF13646,PF02985;PTHR10527,PTHR10527:SF6;NONE;NONE;NONE;GO:0008536,GO:0006886,GO:0005515;AT4G27640.1;NONE;ARM repeat superfamily protein;LOC_Os03g15540.1;NA;HEAT repeat family protein, putative, expressed ","Sobic.001G429400.3;37940539;Sobic.001G429400;Sobic.001G429400.3;Sobic.001G429400.3.p;PF09282;PTHR22959,PTHR22959:SF0;KOG4325;NONE;K14294;NONE;AT1G11400.1;PYM;partner of Y14-MAGO;LOC_Os03g15560.1;NA;wibg, putative, expressed ","Sobic.001G429500.1;37938291;Sobic.001G429500;Sobic.001G429500.1;Sobic.001G429500.1.p;PF01504;PTHR23086,PTHR23086:SF40;KOG0229;2.7.1.68;NONE;GO:0046488,GO:0016307;AT1G77740.1;PIP5K2;phosphatidylinositol-4-phosphate 5-kinase 2;LOC_Os03g15550.1;NA;phosphatidylinositol-4-phosphate 5-kinase, putative, expressed ", , , , , , , , , , , , 
NsiI.TP636278,"Sobic.009G055600.1;37920034;Sobic.009G055600;Sobic.009G055600.1;Sobic.009G055600.1.p;PF11721,PF07714;PTHR27003,PTHR27003:SF89;KOG1187;2.7.11.1;NONE;GO:0006468,GO:0004672;AT3G46290.1;HERK1;hercules receptor kinase 1;LOC_Os05g06990.1;NA;TKL_IRAK_CrRLK1L-1.10 - The CrRLK1L-1 subfamily has homology to the CrRLK1L homolog, expressed ","Sobic.009G055700.1;37919519;Sobic.009G055700;Sobic.009G055700.1;Sobic.009G055700.1.p;PF00098,PF00076;PTHR24012,PTHR24012:SF442;KOG0107,KOG0106;NONE;K12896;GO:0008270,GO:0003676;AT2G37340.1;ATRSZ33,RSZ33;arginine/serine-rich zinc knuckle-containing protein 33;LOC_Os03g17710.2;NA;splicing factor, arginine/serine-rich, putative, expressed ", , , , , , , , , , , , , 
NsiI.TP644424,"Sobic.007G090100.1;37937135;Sobic.007G090100;Sobic.007G090100.1;Sobic.007G090100.1.p;PF02362;PTHR31140,PTHR31140:SF19;NONE;NONE;NONE;GO:0003677;AT2G46870.1;NGA1;AP2/B3-like transcriptional factor family protein;LOC_Os02g45850.1;NA;B3 DNA binding domain containing protein, expressed ", , , , , , , , , , , , , , 
NsiI.TP644722,"Sobic.007G090100.1;37937135;Sobic.007G090100;Sobic.007G090100.1;Sobic.007G090100.1.p;PF02362;PTHR31140,PTHR31140:SF19;NONE;NONE;NONE;GO:0003677;AT2G46870.1;NGA1;AP2/B3-like transcriptional factor family protein;LOC_Os02g45850.1;NA;B3 DNA binding domain containing protein, expressed ", , , , , , , , , , , , , , 
NsiI.TP646964,"Sobic.006G178800.1;37947202;Sobic.006G178800;Sobic.006G178800.1;Sobic.006G178800.1.p;PF04783,PF04782;PTHR21450,PTHR21450:SF20;NONE;NONE;NONE;NONE;AT2G17110.1;NONE;Protein of unknown function (DUF630 and DUF632);LOC_Os04g47480.1;NA;DUF630/DUF632 domains containing protein, putative, expressed ","Sobic.006G178900.1;37945767;Sobic.006G178900;Sobic.006G178900.1;Sobic.006G178900.1.p;PF12708;PTHR31375,PTHR31375:SF45;NONE;3.2.1.15;NONE;NONE;AT4G35670.1;NONE;Pectin lyase-like superfamily protein;LOC_Os07g10740.1;NA;polygalacturonase, putative, expressed ", , , , , , , , , , , , , 
NsiI.TP652621,"Sobic.006G217800.1;37948683;Sobic.006G217800;Sobic.006G217800.1;Sobic.006G217800.1.p;PF00010;PTHR12565,PTHR12565:SF145;NONE;NONE;NONE;GO:0046983;AT1G09530.1;PAP3,PIF3,POC1;phytochrome interacting factor 3;LOC_Os04g52770.1;NA;helix-loop-helix DNA-binding domain containing protein, expressed ","Sobic.006G217700.1;37948170;Sobic.006G217700;Sobic.006G217700.1;Sobic.006G217700.1.p;PF14938;PTHR13768,PTHR13768:SF2;KOG1585;NONE;NONE;GO:0006886;AT4G20410.1;GAMMA-SNAP,GSNAP;gamma-soluble NSF attachment protein;LOC_Os04g52760.1;NA;gamma-soluble NSF attachment protein, putative, expressed ","Sobic.006G217900.1;37946466;Sobic.006G217900;Sobic.006G217900.1;Sobic.006G217900.1.p;PF08263,PF00560,PF00069,PF13855;PTHR27000,PTHR27000:SF90;KOG1187;2.7.11.1;K13420;GO:0005515,GO:0006468,GO:0005524,GO:0004672;AT5G46330.1;FLS2;Leucine-rich receptor-like protein kinase family protein;LOC_Os04g52780.1;NA;leucine-rich repeat receptor protein kinase EXS precursor, putative, expressed ","Sobic.006G217900.2;37946467;Sobic.006G217900;Sobic.006G217900.2;Sobic.006G217900.2.p;PF08263,PF00560,PF00069,PF13855;PTHR27000,PTHR27000:SF90;KOG1187;2.7.11.1;NONE;GO:0005515,GO:0006468,GO:0005524,GO:0004672;AT5G46330.1;FLS2;Leucine-rich receptor-like protein kinase family protein;LOC_Os04g52780.1;NA;leucine-rich repeat receptor protein kinase EXS precursor, putative, expressed ", , , , , , , , , , , 
NsiI.TP659581,"Sobic.003G400100.1;37918666;Sobic.003G400100;Sobic.003G400100.1;Sobic.003G400100.1.p;PF14416,PF13839;PTHR32285,PTHR32285:SF18;NONE;NONE;NONE;NONE;AT5G51640.1;TBL17,YLS7;Plant protein of unknown function (DUF828);LOC_Os01g68630.1;NA;leaf senescence related protein, putative, expressed ","Sobic.003G400100.2;37918667;Sobic.003G400100;Sobic.003G400100.2;Sobic.003G400100.2.p;PF14416,PF13839;PTHR32285,PTHR32285:SF18;NONE;NONE;NONE;NONE;AT5G51640.1;TBL17,YLS7;Plant protein of unknown function (DUF828);LOC_Os01g68630.1;NA;leaf senescence related protein, putative, expressed ","Sobic.003G400332.1;37915577;Sobic.003G400332;Sobic.003G400332.1;Sobic.003G400332.1.p;NONE;PTHR11730,PTHR11730:SF45;NONE;NONE;NONE;GO:0072488,GO:0016020,GO:0008519;AT2G38290.1;AMT2,AMT2_1,ATAMT2;ammonium transporter 2;LOC_Os07g07070.1;NA;anthranilate phosphoribosyltransferase, putative, expressed ","Sobic.003G400200.1;37915743;Sobic.003G400200;Sobic.003G400200.1;Sobic.003G400200.1.p;PF04720;PTHR31579,PTHR31579:SF9;NONE;NONE;NONE;NONE;AT3G07350.1;NONE;Protein of unknown function (DUF506) ;LOC_Os01g68650.1;NA;plant-specific domain TIGR01615 family protein, expressed ", , , , , , , , , , , 
NsiI.TP668488,"Sobic.007G064900.1;37935155;Sobic.007G064900;Sobic.007G064900.1;Sobic.007G064900.1.p;PF02535;PTHR11040,PTHR11040:SF49;KOG1558;NONE;K14709;GO:0055085,GO:0046873,GO:0030001,GO:0016020;AT1G05300.1;ZIP5;zinc transporter 5 precursor;LOC_Os05g39540.1;NA;metal cation transporter, putative, expressed ", , , , , , , , , , , , , , 
NsiI.TP670301,"Sobic.001G485400.1;37943760;Sobic.001G485400;Sobic.001G485400.1;Sobic.001G485400.1.p;NONE;PTHR33541,PTHR33541:SF5;NONE;NONE;NONE;NONE;AT3G13980.1;NONE;NONE;LOC_Os03g07920.1;NA;expressed protein ","Sobic.001G485300.1;37941399;Sobic.001G485300;Sobic.001G485300.1;Sobic.001G485300.1.p;PF02186;PTHR12716,PTHR12716:SF8;KOG3095;NONE;K03137;GO:0006367;AT4G20330.1;NONE;Transcription initiation factor TFIIE, beta subunit;LOC_Os10g25770.2;NA;transcription initiation factor IIE subunit beta, putative, expressed ", , , , , , , , , , , , , 
