PstI.TP541575,"Sobic.002G389000.1;37951165;Sobic.002G389000;Sobic.002G389000.1;Sobic.002G389000.1.p;PF00067;PTHR24282,PTHR24282:SF44;KOG0157;NONE;NONE;GO:0055114,GO:0020037,GO:0016705,GO:0005506;AT2G46950.1;CYP709B2;cytochrome P450, family 709, subfamily B, polypeptide 2;LOC_Os07g23570.1;NA;cytochrome P450 72A1, putative, expressed ","Sobic.002G389100.1;37953915;Sobic.002G389100;Sobic.002G389100.1;Sobic.002G389100.1.p;PF00067;PTHR24282,PTHR24282:SF44;KOG0157;NONE;NONE;GO:0055114,GO:0020037,GO:0016705,GO:0005506;AT2G46950.1;CYP709B2;cytochrome P450, family 709, subfamily B, polypeptide 2;LOC_Os07g44140.1;NA;cytochrome P450 72A1, putative, expressed ","Sobic.002G389200.3;37951723;Sobic.002G389200;Sobic.002G389200.3;Sobic.002G389200.3.p;PF13812,PF01535,PF13041;PTHR24015,PTHR24015:SF70;NONE;NONE;NONE;NONE;AT3G57430.1;OTP84;Tetratricopeptide repeat (TPR)-like superfamily protein;LOC_Os07g44170.1;NA;pentatricopeptide repeat domain containing protein, putative, expressed ","Sobic.002G389200.5;37951720;Sobic.002G389200;Sobic.002G389200.5;Sobic.002G389200.5.p;PF13812,PF01535,PF13041;PTHR24015,PTHR24015:SF70;NONE;NONE;NONE;NONE;AT3G57430.1;OTP84;Tetratricopeptide repeat (TPR)-like superfamily protein;LOC_Os07g44170.1;NA;pentatricopeptide repeat domain containing protein, putative, expressed ","Sobic.002G389200.2;37951718;Sobic.002G389200;Sobic.002G389200.2;Sobic.002G389200.2.p;PF13812,PF01535,PF13041;PTHR24015,PTHR24015:SF70;NONE;NONE;NONE;NONE;AT3G57430.1;OTP84;Tetratricopeptide repeat (TPR)-like superfamily protein;LOC_Os07g44170.1;NA;pentatricopeptide repeat domain containing protein, putative, expressed ","Sobic.002G389200.6;37951719;Sobic.002G389200;Sobic.002G389200.6;Sobic.002G389200.6.p;PF13812,PF01535,PF13041;PTHR24015,PTHR24015:SF70;NONE;NONE;NONE;NONE;AT3G57430.1;OTP84;Tetratricopeptide repeat (TPR)-like superfamily protein;LOC_Os07g44170.1;NA;pentatricopeptide repeat domain containing protein, putative, expressed ","Sobic.002G389200.4;37951722;Sobic.002G389200;Sobic.002G389200.4;Sobic.002G389200.4.p;PF13812,PF01535,PF13041;PTHR24015,PTHR24015:SF70;NONE;NONE;NONE;NONE;AT3G57430.1;OTP84;Tetratricopeptide repeat (TPR)-like superfamily protein;LOC_Os07g44170.1;NA;pentatricopeptide repeat domain containing protein, putative, expressed ","Sobic.002G389200.1;37951721;Sobic.002G389200;Sobic.002G389200.1;Sobic.002G389200.1.p;PF13812,PF01535,PF13041;PTHR24015,PTHR24015:SF70;NONE;NONE;NONE;NONE;AT3G57430.1;OTP84;Tetratricopeptide repeat (TPR)-like superfamily protein;LOC_Os07g44170.1;NA;pentatricopeptide repeat domain containing protein, putative, expressed ", , , , , , , 
PstI.TP544110,"Sobic.007G165000.1;37935574;Sobic.007G165000;Sobic.007G165000.1;Sobic.007G165000.1.p;PF13639;PTHR14155,PTHR14155:SF113;NONE;NONE;NONE;GO:0008270,GO:0005515;AT5G43420.1;NONE;RING/U-box superfamily protein;LOC_Os02g57460.1;NA;RING-H2 finger protein ATL5G, putative, expressed ","Sobic.007G165100.1;37937243;Sobic.007G165100;Sobic.007G165100.1;Sobic.007G165100.1.p;PF03195;PTHR31529,PTHR31529:SF5;NONE;NONE;NONE;NONE;AT3G58190.1;ASL16,LBD29;lateral organ boundaries-domain 29;LOC_Os08g44940.1;NA;DUF260 domain containing protein, putative, expressed ","Sobic.007G164900.1;37934295;Sobic.007G164900;Sobic.007G164900.1;Sobic.007G164900.1.p;PF00847;PTHR31190,PTHR31190:SF33;NONE;NONE;NONE;GO:0006355,GO:0003700;AT3G23230.1;NONE;Integrase-type DNA-binding superfamily protein;LOC_Os08g44960.1;NA;AP2 domain containing protein, expressed ", , , , , , , , , , , , 
PstI.TP544549,"Sobic.006G014900.1;37949458;Sobic.006G014900;Sobic.006G014900.1;Sobic.006G014900.1.p;PF03000;PTHR32370,PTHR32370:SF6;NONE;NONE;NONE;GO:0016567;AT5G64330.1;JK218,NPH3,RPT3;Phototropic-responsive NPH3 family protein;LOC_Os02g35970.1;NA;BTBN2 - Bric-a-Brac, Tramtrack, Broad Complex BTB domain with non-phototropic hypocotyl 3 NPH3 and coiled-coil domains, expressed ", , , , , , , , , , , , , , 
PstI.TP548709,"Sobic.002G221400.2;37953259;Sobic.002G221400;Sobic.002G221400.2;Sobic.002G221400.2.p;NONE;PTHR10593,PTHR10593:SF40;NONE;NONE;NONE;NONE;AT1G25250.1;AtIDD16,IDD16;indeterminate(ID)-domain 16;LOC_Os09g27650.2;NA;ZOS9-14 - C2H2 zinc finger protein, expressed ","Sobic.002G221400.1;37953258;Sobic.002G221400;Sobic.002G221400.1;Sobic.002G221400.1.p;NONE;PTHR10593,PTHR10593:SF40;NONE;NONE;NONE;NONE;AT1G25250.1;AtIDD16,IDD16;indeterminate(ID)-domain 16;LOC_Os09g27650.2;NA;ZOS9-14 - C2H2 zinc finger protein, expressed ","Sobic.002G221500.1;37950008;Sobic.002G221500;Sobic.002G221500.1;Sobic.002G221500.1.p;PF07651;PTHR22951,PTHR22951:SF19;NONE;NONE;NONE;GO:0005543;AT1G25240.1;NONE;ENTH/VHS/GAT family protein;LOC_Os08g36410.1;NA;ANTH domain containing protein, expressed ", , , , , , , , , , , , 
PstI.TP549992,"Sobic.001G428400.1;37937448;Sobic.001G428400;Sobic.001G428400.1;Sobic.001G428400.1.p;PF12874,PF16835;PTHR23205,PTHR23205:SF0;KOG0227;NONE;K12826;NONE;AT2G32600.1;NONE;hydroxyproline-rich glycoprotein family protein;NONE;NA;NONE ","Sobic.001G428500.1;37937998;Sobic.001G428500;Sobic.001G428500.1;Sobic.001G428500.1.p;PF00153;PTHR24089,PTHR24089:SF345;KOG0767;NONE;K15102;NONE;AT5G14040.1;PHT3_1;phosphate transporter 3_1;LOC_Os03g15690.1;NA;phosphate carrier protein, mitochondrial precursor, putative, expressed ","Sobic.001G428600.2;37939922;Sobic.001G428600;Sobic.001G428600.2;Sobic.001G428600.2.p;PF03514;PTHR31636,PTHR31636:SF25;NONE;NONE;NONE;NONE;AT4G08250.1;NONE;GRAS family transcription factor;LOC_Os03g15680.1;NA;nodulation-signaling pathway 2 protein, putative, expressed ", , , , , , , , , , , , 
PstI.TP568461,"Sobic.003G445100.2;37918557;Sobic.003G445100;Sobic.003G445100.2;Sobic.003G445100.2.p;PF00076;PTHR24012;NONE;NONE;NONE;GO:0003676;AT5G61030.1;GR-RBP3;glycine-rich RNA-binding protein 3;LOC_Os01g74340.1;NA;RNA recognition motif containing protein, putative, expressed ","Sobic.003G445100.1;37918556;Sobic.003G445100;Sobic.003G445100.1;Sobic.003G445100.1.p;PF00076;PTHR24012;NONE;NONE;K13195;GO:0003676;AT5G61030.1;GR-RBP3;glycine-rich RNA-binding protein 3;LOC_Os01g74340.1;NA;RNA recognition motif containing protein, putative, expressed ","Sobic.003G445000.1;37918652;Sobic.003G445000;Sobic.003G445000.1;Sobic.003G445000.1.p;PF03283;PTHR21562,PTHR21562:SF20;KOG4287;NONE;NONE;GO:0016787;AT3G09410.1;NONE;Pectinacetylesterase family protein;LOC_Os01g74330.1;NA;pectinacetylesterase domain containing protein, expressed ","Sobic.003G445000.2;37918653;Sobic.003G445000;Sobic.003G445000.2;Sobic.003G445000.2.p;PF03283;PTHR21562,PTHR21562:SF20;NONE;NONE;NONE;GO:0016787;AT3G09410.1;NONE;Pectinacetylesterase family protein;LOC_Os01g74330.1;NA;pectinacetylesterase domain containing protein, expressed ",Sobic.003G445200.1;37917178;Sobic.003G445200;Sobic.003G445200.1;Sobic.003G445200.1.p;NONE;NONE;NONE;NONE;NONE;NONE;AT2G39500.1;NONE;NONE;NONE;NA;NONE ,"Sobic.003G445300.2;37914701;Sobic.003G445300;Sobic.003G445300.2;Sobic.003G445300.2.p;PF00230;PTHR19139,PTHR19139:SF55;KOG0223;NONE;K09873;GO:0016020,GO:0006810,GO:0005215;AT4G01470.1;ATTIP1.3,GAMMA-TIP3,TIP1_3;tonoplast intrinsic protein 1_3;LOC_Os01g74450.1;NA;aquaporin protein, putative, expressed ","Sobic.003G445400.3;37917018;Sobic.003G445400;Sobic.003G445400.3;Sobic.003G445400.3.p;PF03164;PTHR13027,PTHR13027:SF7;KOG0997;NONE;NONE;NONE;AT2G28390.1;NONE;SAND family protein;LOC_Os01g74460.2;NA;vacuolar fusion protein MON1 homolog A, putative, expressed ","Sobic.003G445400.4;37917020;Sobic.003G445400;Sobic.003G445400.4;Sobic.003G445400.4.p;PF03164;PTHR13027,PTHR13027:SF7;KOG0997;NONE;NONE;NONE;AT2G28390.1;NONE;SAND family protein;LOC_Os01g74460.2;NA;vacuolar fusion protein MON1 homolog A, putative, expressed ","Sobic.003G445400.1;37917019;Sobic.003G445400;Sobic.003G445400.1;Sobic.003G445400.1.p;PF03164;PTHR13027,PTHR13027:SF7;KOG0997;NONE;NONE;NONE;AT2G28390.1;NONE;SAND family protein;LOC_Os01g74460.2;NA;vacuolar fusion protein MON1 homolog A, putative, expressed ", , , , , , 
PstI.TP569914,"Sobic.005G014000.1;37925703;Sobic.005G014000;Sobic.005G014000.1;Sobic.005G014000.1.p;PF03106;PTHR31282,PTHR31282:SF11;NONE;NONE;NONE;GO:0043565,GO:0006355,GO:0003700;AT2G40750.1;ATWRKY54,WRKY54;WRKY DNA-binding protein 54;LOC_Os12g02450.1;NA;WRKY64, expressed ", , , , , , , , , , , , , , 
PstI.TP572438,"Sobic.003G403900.2;37913532;Sobic.003G403900;Sobic.003G403900.2;Sobic.003G403900.2.p;PF03547;PTHR31752,PTHR31752:SF2;NONE;NONE;NONE;GO:0055085,GO:0016021;AT5G16530.1;PIN5;Auxin efflux carrier family protein;LOC_Os01g69070.1;NA;auxin efflux carrier component, putative, expressed ","Sobic.003G403900.3;37913533;Sobic.003G403900;Sobic.003G403900.3;Sobic.003G403900.3.p;PF03547;PTHR31752,PTHR31752:SF2;NONE;NONE;NONE;GO:0055085,GO:0016021;AT5G16530.1;PIN5;Auxin efflux carrier family protein;LOC_Os01g69070.1;NA;auxin efflux carrier component, putative, expressed ","Sobic.003G403900.1;37913531;Sobic.003G403900;Sobic.003G403900.1;Sobic.003G403900.1.p;PF03547;PTHR31752,PTHR31752:SF2;NONE;NONE;K13947;GO:0055085,GO:0016021;AT5G16530.1;PIN5;Auxin efflux carrier family protein;LOC_Os01g69070.1;NA;auxin efflux carrier component, putative, expressed ","Sobic.003G404000.1;37917228;Sobic.003G404000;Sobic.003G404000.1;Sobic.003G404000.1.p;PF03405;PTHR31155,PTHR31155:SF9;NONE;1.14.19.2;K03921;GO:0055114,GO:0045300,GO:0006631;AT2G43710.1;FAB2,SSI2;Plant stearoyl-acyl-carrier-protein desaturase family protein;LOC_Os01g69080.1;NA;acyl-desaturase, chloroplast precursor, putative, expressed ","Sobic.003G404100.1;37918203;Sobic.003G404100;Sobic.003G404100.1;Sobic.003G404100.1.p;PF00571;PTHR13780,PTHR13780:SF46;KOG1764;NONE;NONE;NONE;AT1G65320.1;NONE;Cystathionine beta-synthase (CBS) family protein;LOC_Os01g69090.1;NA;CBS domain-containing protein, putative, expressed ", , , , , , , , , , 
PstI.TP576366,"Sobic.002G002700.1;37952458;Sobic.002G002700;Sobic.002G002700.1;Sobic.002G002700.1.p;PF00497,PF13458,PF00060;PTHR18966,PTHR18966:SF235;KOG1052;NONE;K05387;GO:0016020,GO:0004970;AT1G05200.1;ATGLR3.4,GLR3.4,GLUR3;glutamate receptor 3.4;LOC_Os07g01310.1;NA;glutamate receptor, putative, expressed ","Sobic.002G002800.1;37952092;Sobic.002G002800;Sobic.002G002800.1;Sobic.002G002800.1.p;PF13458,PF00497,PF00060;PTHR18966,PTHR18966:SF235;KOG1052;NONE;K05387;GO:0016020,GO:0004970;AT1G05200.1;ATGLR3.4,GLR3.4,GLUR3;glutamate receptor 3.4;LOC_Os07g01310.1;NA;glutamate receptor, putative, expressed ", , , , , , , , , , , , , 
PstI.TP581762,"Sobic.004G284800.1;37931707;Sobic.004G284800;Sobic.004G284800.1;Sobic.004G284800.1.p;PF00069;PTHR13902,PTHR13902:SF57;NONE;2.7.11.1;K08867;GO:0006468,GO:0005524,GO:0004672;AT3G18750.1;ATWNK6,WNK6,ZIK5;with no lysine (K) kinase 6;LOC_Os02g45130.1;NA;protein kinase, putative, expressed ","Sobic.004G284800.2;37931708;Sobic.004G284800;Sobic.004G284800.2;Sobic.004G284800.2.p;PF00069;PTHR13902,PTHR13902:SF57;NONE;2.7.11.1;NONE;GO:0006468,GO:0005524,GO:0004672;AT3G18750.1;ATWNK6,WNK6,ZIK5;with no lysine (K) kinase 6;LOC_Os02g45130.1;NA;protein kinase, putative, expressed ","Sobic.004G284900.1;37930159;Sobic.004G284900;Sobic.004G284900.1;Sobic.004G284900.1.p;PF01096;PTHR11239,PTHR11239:SF12;KOG2906;2.7.7.6;K03019;GO:0008270,GO:0006351,GO:0003676;AT4G07950.1;NONE;DNA-directed RNA polymerase, subunit M, archaeal;LOC_Os02g45120.2;NA;expressed protein ","Sobic.004G285000.1;37933917;Sobic.004G285000;Sobic.004G285000.1;Sobic.004G285000.1.p;PF05063;PTHR12829,PTHR12829:SF2;NONE;2.1.1.62;K05925;GO:0008168,GO:0006139;AT4G10760.1;EMB1706,MTA;mRNAadenosine methylase;LOC_Os02g45110.1;NA;MT-A70 domain containing protein, expressed ", , , , , , , , , , , 
PstI.TP591413,"Sobic.006G047400.1;37945526;Sobic.006G047400;Sobic.006G047400.1;Sobic.006G047400.1.p;PF01780;NONE;KOG0402;NONE;K02921;GO:0006412,GO:0005840,GO:0005622,GO:0003735;AT3G10950.1;NONE;Zinc-binding ribosomal protein family protein;LOC_Os05g48320.1;NA;60S ribosomal protein L37a, putative, expressed ", , , , , , , , , , , , , , 
PstI.TP602287,"Sobic.007G085300.1;37935104;Sobic.007G085300;Sobic.007G085300.1;Sobic.007G085300.1.p;PF10533,PF03106;PTHR31282,PTHR31282:SF32;NONE;NONE;NONE;GO:0043565,GO:0006355,GO:0003700;AT4G31550.1;ATWRKY11,WRKY11;WRKY DNA-binding protein 11;LOC_Os04g51560.1;NA;WRKY68, expressed ", , , , , , , , , , , , , , 
PstI.TP607682,"Sobic.006G239200.1;37948575;Sobic.006G239200;Sobic.006G239200.1;Sobic.006G239200.1.p;PF10294;PTHR14614,PTHR14614:SF3;NONE;NONE;NONE;NONE;AT3G50850.1;NONE;Putative methyltransferase family protein;LOC_Os04g55250.1;NA;expressed protein ","Sobic.006G239100.2;37946578;Sobic.006G239100;Sobic.006G239100.2;Sobic.006G239100.2.p;PF05678;PTHR33402;NONE;NONE;NONE;NONE;AT1G80450.1;NONE;VQ motif-containing protein;LOC_Os04g55240.1;NA;VQ domain containing protein, putative, expressed ","Sobic.006G239300.1;37946513;Sobic.006G239300;Sobic.006G239300.1;Sobic.006G239300.1.p;PF00892;PTHR23051,PTHR23051:SF2;KOG2765;NONE;K15289;GO:0016021,GO:0016020;AT4G32140.1;NONE;EamA-like transporter family;LOC_Os04g55260.1;NA;thiamine-repressible mitochondrial transport protein THI74, putative, expressed ","Sobic.006G239400.1;37949310;Sobic.006G239400;Sobic.006G239400.1;Sobic.006G239400.1.p;PF02148,PF13423;PTHR24006,PTHR24006:SF465;KOG1867;3.4.19.12;K11366;GO:0008270;AT5G10790.1;UBP22;ubiquitin-specific protease 22;LOC_Os04g55360.1;NA;ubiquitin carboxyl-terminal hydrolase domain containing protein, expressed ","Sobic.006G239500.1;37945353;Sobic.006G239500;Sobic.006G239500.1;Sobic.006G239500.1.p;PF03140;PTHR31549,PTHR31549:SF31;NONE;NONE;NONE;NONE;AT3G50170.1;NONE;Plant protein of unknown function (DUF247);LOC_Os04g55370.1;NA;plant protein of unknown function domain containing protein, expressed ", , , , , , , , , , 
PstI.TP6170,"Sobic.006G219801.5;37947211;Sobic.006G219801;Sobic.006G219801.5;Sobic.006G219801.5.p;PF13191;PTHR23155,PTHR23155:SF538;KOG4658;NONE;NONE;NONE;AT3G14470.1;NONE;NB-ARC domain-containing disease resistance protein;LOC_Os04g53120.1;NA;NB-ARC domain containing protein, expressed ","Sobic.006G219801.1;37947208;Sobic.006G219801;Sobic.006G219801.1;Sobic.006G219801.1.p;PF13191;PTHR23155,PTHR23155:SF538;KOG4658;NONE;NONE;NONE;AT3G14470.1;NONE;NB-ARC domain-containing disease resistance protein;LOC_Os04g53160.1;NA;NBS-LRR disease resistance protein, putative, expressed ","Sobic.006G219801.6;37947213;Sobic.006G219801;Sobic.006G219801.6;Sobic.006G219801.6.p;PF13191;PTHR23155,PTHR23155:SF538;KOG4658;NONE;NONE;NONE;AT3G14470.1;NONE;NB-ARC domain-containing disease resistance protein;LOC_Os04g53160.1;NA;NBS-LRR disease resistance protein, putative, expressed ","Sobic.006G219801.8;37947215;Sobic.006G219801;Sobic.006G219801.8;Sobic.006G219801.8.p;PF13191;PTHR23155,PTHR23155:SF538;KOG4658;NONE;NONE;NONE;AT3G14470.1;NONE;NB-ARC domain-containing disease resistance protein;LOC_Os04g53120.1;NA;NB-ARC domain containing protein, expressed ","Sobic.006G219801.3;37947210;Sobic.006G219801;Sobic.006G219801.3;Sobic.006G219801.3.p;PF13191;PTHR23155,PTHR23155:SF538;KOG4658;NONE;NONE;NONE;AT3G14470.1;NONE;NB-ARC domain-containing disease resistance protein;LOC_Os04g53160.1;NA;NBS-LRR disease resistance protein, putative, expressed ","Sobic.006G219801.4;37947212;Sobic.006G219801;Sobic.006G219801.4;Sobic.006G219801.4.p;PF13191;PTHR23155,PTHR23155:SF538;KOG4658;NONE;NONE;NONE;AT3G14470.1;NONE;NB-ARC domain-containing disease resistance protein;LOC_Os04g53120.1;NA;NB-ARC domain containing protein, expressed ","Sobic.006G219801.7;37947214;Sobic.006G219801;Sobic.006G219801.7;Sobic.006G219801.7.p;PF13191;PTHR23155,PTHR23155:SF538;KOG4658;NONE;NONE;NONE;AT3G14470.1;NONE;NB-ARC domain-containing disease resistance protein;LOC_Os04g53120.1;NA;NB-ARC domain containing protein, expressed ","Sobic.006G219801.2;37947209;Sobic.006G219801;Sobic.006G219801.2;Sobic.006G219801.2.p;PF13191;PTHR23155,PTHR23155:SF538;KOG4658;NONE;NONE;NONE;AT3G14470.1;NONE;NB-ARC domain-containing disease resistance protein;LOC_Os04g53160.1;NA;NBS-LRR disease resistance protein, putative, expressed ","Sobic.006G219700.1;37948894;Sobic.006G219700;Sobic.006G219700.1;Sobic.006G219700.1.p;PF05627;PTHR33159;NONE;NONE;NONE;NONE;AT5G55850.1;NOI;RPM1-interacting protein 4 (RIN4) family protein;LOC_Os04g52950.1;NA;nitrate-induced NOI protein, expressed ", , , , , , 
PstI.TP621994,"Sobic.003G446100.4;37914316;Sobic.003G446100;Sobic.003G446100.4;Sobic.003G446100.4.p;PF00855;PTHR35491,PTHR35491:SF1;NONE;2.7.11.1;NONE;NONE;AT5G02950.1;NONE;Tudor/PWWP/MBT superfamily protein;LOC_Os11g19810.1;NA;PWWP domain containing protein, expressed ","Sobic.003G446100.3;37914317;Sobic.003G446100;Sobic.003G446100.3;Sobic.003G446100.3.p;PF00855;PTHR35491,PTHR35491:SF1;NONE;2.7.11.1;NONE;NONE;AT5G02950.1;NONE;Tudor/PWWP/MBT superfamily protein;LOC_Os11g19810.1;NA;PWWP domain containing protein, expressed ","Sobic.003G446100.1;37914315;Sobic.003G446100;Sobic.003G446100.1;Sobic.003G446100.1.p;PF00855;PTHR35491,PTHR35491:SF1;NONE;2.7.11.1;NONE;NONE;AT5G02950.1;NONE;Tudor/PWWP/MBT superfamily protein;LOC_Os11g19810.1;NA;PWWP domain containing protein, expressed ", , , , , , , , , , , , 
PstI.TP622176,"Sobic.003G324500.1;37916828;Sobic.003G324500;Sobic.003G324500.1;Sobic.003G324500.1.p;PF00847;PTHR31677,PTHR31677:SF25;NONE;NONE;NONE;GO:0006355,GO:0003700;AT1G28360.1;ATERF12,ERF12;ERF domain protein 12;LOC_Os05g41760.1;NA;AP2 domain containing protein, expressed ","Sobic.003G324700.1;37914620;Sobic.003G324700;Sobic.003G324700.1;Sobic.003G324700.1.p;NONE;PTHR33672,PTHR33672:SF3;NONE;NONE;NONE;NONE;AT5G44650.1;AtCEST,CEST;NONE;LOC_Os01g58470.1;NA;expressed protein ","Sobic.003G324600.1;37917902;Sobic.003G324600;Sobic.003G324600.1;Sobic.003G324600.1.p;PF14215;PTHR13902,PTHR13902:SF3;NONE;NONE;NONE;NONE;AT5G53900.2;NONE;Serine/threonine-protein kinase WNK (With No Lysine)-related;LOC_Os11g25920.1;NA;transcription factor-related, putative, expressed ", , , , , , , , , , , , 
PstI.TP624280,"Sobic.008G012700.1;37928071;Sobic.008G012700;Sobic.008G012700.1;Sobic.008G012700.1.p;PF03514;PTHR31636:SF21,PTHR31636;NONE;NONE;NONE;NONE;AT1G50420.1;SCL-3,SCL3;scarecrow-like 3;LOC_Os12g04370.1;NA;GRAS family transcription factor containing protein, expressed ","Sobic.008G012800.2;37928347;Sobic.008G012800;Sobic.008G012800.2;Sobic.008G012800.2.p;PF03514;PTHR31636,PTHR31636:SF32;NONE;NONE;NONE;NONE;AT1G50420.1;SCL-3,SCL3;scarecrow-like 3;LOC_Os12g04370.1;NA;GRAS family transcription factor containing protein, expressed ","Sobic.008G012900.1;37926696;Sobic.008G012900;Sobic.008G012900.1;Sobic.008G012900.1.p;PF13499;PTHR10891,PTHR10891:SF590;NONE;NONE;K13448;NONE;AT3G10190.1;NONE;Calcium-binding EF-hand family protein;LOC_Os12g04360.1;NA;calmodulin-like protein 1, putative, expressed ", , , , , , , , , , , , 
PstI.TP626274,"Sobic.009G001200.1;37919697;Sobic.009G001200;Sobic.009G001200.1;Sobic.009G001200.1.p;PF13920,PF00097,PF02182;PTHR14140;NONE;2.1.1.43;K10638;GO:0046872,GO:0042393;AT1G57820.1;ORTH2,VIM1;Zinc finger (C3HC4-type RING finger) family protein;LOC_Os05g01230.1;NA;zinc finger, C3HC4 type domain containing protein, expressed ","Sobic.009G001400.1;37922455;Sobic.009G001400;Sobic.009G001400.1;Sobic.009G001400.1.p;PF03357;PTHR22761,PTHR22761:SF17;KOG1655;NONE;K12198;GO:0007034;AT3G10640.1;VPS60.1;SNF7 family protein;LOC_Os05g01250.1;NA;SNF7 domain containing protein, putative, expressed ","Sobic.009G001300.1;37920886;Sobic.009G001300;Sobic.009G001300.1;Sobic.009G001300.1.p;PF04059;PTHR24012,PTHR24012:SF424;KOG4660;NONE;NONE;NONE;AT5G07290.1;AML4,ML4;MEI2-like 4;LOC_Os05g01240.5;NA;AML1, putative, expressed ","Sobic.009G001300.4;37920890;Sobic.009G001300;Sobic.009G001300.4;Sobic.009G001300.4.p;PF04059;PTHR24012,PTHR24012:SF424;KOG4660;NONE;NONE;NONE;AT5G07290.1;AML4,ML4;MEI2-like 4;LOC_Os05g01240.2;NA;AML1, putative, expressed ","Sobic.009G001300.5;37920888;Sobic.009G001300;Sobic.009G001300.5;Sobic.009G001300.5.p;PF04059;PTHR24012,PTHR24012:SF424;KOG4660;NONE;NONE;NONE;AT5G07290.1;AML4,ML4;MEI2-like 4;LOC_Os05g01240.4;NA;AML1, putative, expressed ","Sobic.009G001300.2;37920889;Sobic.009G001300;Sobic.009G001300.2;Sobic.009G001300.2.p;PF04059;PTHR24012,PTHR24012:SF424;KOG4660;NONE;NONE;NONE;AT5G07290.1;AML4,ML4;MEI2-like 4;LOC_Os05g01240.3;NA;AML1, putative, expressed ","Sobic.009G001300.3;37920887;Sobic.009G001300;Sobic.009G001300.3;Sobic.009G001300.3.p;PF04059;PTHR24012,PTHR24012:SF424;KOG4660;NONE;NONE;NONE;AT5G07290.1;AML4,ML4;MEI2-like 4;LOC_Os05g01240.5;NA;AML1, putative, expressed ", , , , , , , , 
PstI.TP629259,"Sobic.001G056601.1;37944935;Sobic.001G056601;Sobic.001G056601.1;Sobic.001G056601.1.p;PF00977;NONE;NONE;4.2.1.20,4.1.2.8;K01695;GO:0000105;AT4G02610.1;NONE;Aldolase-type TIM barrel family protein;LOC_Os03g58260.2;NA;indole-3-glycerol phosphate lyase, chloroplast precursor, putative, expressed ","Sobic.001G056601.2;37944936;Sobic.001G056601;Sobic.001G056601.2;Sobic.001G056601.2.p;PF00977;NONE;NONE;4.2.1.20,4.1.2.8;K01695;GO:0000105;AT3G54640.1;TRP3,TSA1;tryptophan synthase alpha chain;LOC_Os03g58260.2;NA;indole-3-glycerol phosphate lyase, chloroplast precursor, putative, expressed ","Sobic.001G056700.1;37942793;Sobic.001G056700;Sobic.001G056700.1;Sobic.001G056700.1.p;PF00170,PF12498;PTHR22952,PTHR22952:SF90;NONE;NONE;NONE;GO:0043565,GO:0006355,GO:0003700;AT5G28770.2;AtbZIP63,BZO2H3;bZIP transcription factor family protein;LOC_Os03g58250.1;NA;bZIP transcription factor domain containing protein, expressed ","Sobic.001G056800.1;37938105;Sobic.001G056800;Sobic.001G056800.1;Sobic.001G056800.1.p;PF02841,PF02263;PTHR10751,PTHR10751:SF38;NONE;NONE;NONE;GO:0005525,GO:0003924;AT2G38840.1;NONE;Guanylate-binding family protein;LOC_Os03g58240.1;NA;GTP binding protein, putative, expressed ", , , , , , , , , , , 
PstI.TP633054,"Sobic.007G015700.1;37936018;Sobic.007G015700;Sobic.007G015700.1;Sobic.007G015700.1.p;NONE;PTHR23155,PTHR23155:SF485;NONE;NONE;NONE;NONE;AT3G07040.1;RPM1,RPS3;NB-ARC domain-containing disease resistance protein;LOC_Os11g43390.1;NA;expressed protein ", , , , , , , , , , , , , , 
PstI.TP634696,"Sobic.002G221400.2;37953259;Sobic.002G221400;Sobic.002G221400.2;Sobic.002G221400.2.p;NONE;PTHR10593,PTHR10593:SF40;NONE;NONE;NONE;NONE;AT1G25250.1;AtIDD16,IDD16;indeterminate(ID)-domain 16;LOC_Os09g27650.2;NA;ZOS9-14 - C2H2 zinc finger protein, expressed ","Sobic.002G221400.1;37953258;Sobic.002G221400;Sobic.002G221400.1;Sobic.002G221400.1.p;NONE;PTHR10593,PTHR10593:SF40;NONE;NONE;NONE;NONE;AT1G25250.1;AtIDD16,IDD16;indeterminate(ID)-domain 16;LOC_Os09g27650.2;NA;ZOS9-14 - C2H2 zinc finger protein, expressed ","Sobic.002G221500.1;37950008;Sobic.002G221500;Sobic.002G221500.1;Sobic.002G221500.1.p;PF07651;PTHR22951,PTHR22951:SF19;NONE;NONE;NONE;GO:0005543;AT1G25240.1;NONE;ENTH/VHS/GAT family protein;LOC_Os08g36410.1;NA;ANTH domain containing protein, expressed ", , , , , , , , , , , , 
PstI.TP637101,"Sobic.001G045700.1;37944616;Sobic.001G045700;Sobic.001G045700.1;Sobic.001G045700.1.p;PF13632,PF14569;PTHR13301,PTHR13301:SF45;NONE;2.4.1.12;K10999;NONE;AT5G05170.1;ATCESA3,ATH-B,CESA3,CEV1,IXR1;Cellulose synthase family protein;LOC_Os03g59340.1;NA;CESA2 - cellulose synthase, expressed ","Sobic.001G045900.1;37941719;Sobic.001G045900;Sobic.001G045900.1;Sobic.001G045900.1.p;PF12708;PTHR31375,PTHR31375:SF3;NONE;3.2.1.15;NONE;NONE;AT3G57510.1;ADPG1;Pectin lyase-like superfamily protein;LOC_Os07g10740.1;NA;polygalacturonase, putative, expressed ","Sobic.001G045800.1;37944003;Sobic.001G045800;Sobic.001G045800.1;Sobic.001G045800.1.p;PF00295;PTHR31375,PTHR31375:SF3;NONE;3.2.1.15;NONE;GO:0005975,GO:0004650;AT2G41850.1;ADPG2,PGAZAT;polygalacturonase abscission zone A. thaliana;LOC_Os07g10740.1;NA;polygalacturonase, putative, expressed ","Sobic.001G046000.1;37944481;Sobic.001G046000;Sobic.001G046000.1;Sobic.001G046000.1.p;PF02341;PTHR33791,PTHR33791:SF4;NONE;NONE;NONE;NONE;AT5G19855.1;NONE;Chaperonin-like RbcX protein;LOC_Os03g59320.1;NA;expressed protein ", , , , , , , , , , , 
PstI.TP639463,"Sobic.006G276300.1;37946032;Sobic.006G276300;Sobic.006G276300.1;Sobic.006G276300.1.p;PF01988;PTHR31851,PTHR31851:SF6;KOG4473;NONE;NONE;NONE;AT3G43660.1;NONE;Vacuolar iron transporter (VIT) family protein;LOC_Os04g59020.1;NA;integral membrane protein, putative, expressed ","Sobic.006G276200.1;37948093;Sobic.006G276200;Sobic.006G276200.1;Sobic.006G276200.1.p;PF00646;PTHR32133,PTHR32133:SF84;NONE;NONE;NONE;GO:0005515;AT1G76920.1;NONE;F-box family protein;LOC_Os04g59010.1;NA;F-box domain containing protein, expressed ", , , , , , , , , , , , , 
