SNP,1,2,3,4,5,6,7,8,9,10,11,12,13,14,15
GFSSContig11619_923,"Sobic.002G249700.1;37951105;Sobic.002G249700;Sobic.002G249700.1;Sobic.002G249700.1.p;PF13947,PF00069;PTHR27005,PTHR27005:SF12;KOG1187;2.7.11.1;NONE;GO:0030247,GO:0006468,GO:0005524,GO:0004672;AT1G21230.1;WAK5;wall associated kinase 5;LOC_Os09g29510.1;NA;OsWAK80 - OsWAK receptor-like protein kinase, expressed ","Sobic.002G249600.1;37950964;Sobic.002G249600;Sobic.002G249600.1;Sobic.002G249600.1.p;PF13947,PF00069;PTHR27005,PTHR27005:SF12;KOG1187;2.7.11.1;NONE;GO:0030247,GO:0006468,GO:0005524,GO:0004672;AT1G21270.1;WAK2;wall-associated kinase 2;LOC_Os09g29510.1;NA;OsWAK80 - OsWAK receptor-like protein kinase, expressed ","Sobic.002G249650.1;37951603;Sobic.002G249650;Sobic.002G249650.1;Sobic.002G249650.1.p;NONE;NONE;NONE;NONE;NONE;NONE;AT1G10000.1;NONE;Ribonuclease H-like superfamily protein;LOC_Os09g15410.1;NA;retrotransposon protein, putative, unclassified ","Sobic.002G249800.1;37951057;Sobic.002G249800;Sobic.002G249800.1;Sobic.002G249800.1.p;PF00012;PTHR19375,PTHR19375:SF202;NONE;NONE;K04043;NONE;AT5G09590.1;HSC70-5,MTHSC70-2;mitochondrial HSO70 2;LOC_Os09g31486.1;NA;DnaK family protein, putative, expressed ","Sobic.002G249900.1;37951860;Sobic.002G249900;Sobic.002G249900.1;Sobic.002G249900.1.p;PF01370;PTHR10366,PTHR10366:SF392;KOG1502;1.2.1.44;NONE;GO:0050662,GO:0003824;AT2G33590.1;NONE;NAD(P)-binding Rossmann-fold superfamily protein;LOC_Os09g31490.1;NA;reductase, putative, expressed ", , , , , , , , , , 
GFSSContig16256_300,"Sobic.003G062300.1;37913178;Sobic.003G062300;Sobic.003G062300.1;Sobic.003G062300.1.p;PF01422;PTHR12360;KOG1952;NONE;K15683;GO:0008270,GO:0006355,GO:0005634,GO:0003700;AT5G05660.1;ATNFXL2;sequence-specific DNA binding transcription factors_zinc ion binding_sequence-specific DNA binding transcription factors;LOC_Os01g06550.1;NA;NF-X1-type zinc finger protein, putative, expressed ","Sobic.003G062400.1;37918218;Sobic.003G062400;Sobic.003G062400.1;Sobic.003G062400.1.p;PF00628,PF12165;PTHR12321,PTHR12321:SF37;KOG1632;NONE;NONE;GO:0005515,GO:0042393,GO:0006355;AT5G05610.2;AL1;alfin-like 1;LOC_Os05g07040.1;NA;PHD finger protein, putative, expressed ","Sobic.003G062400.2;37918217;Sobic.003G062400;Sobic.003G062400.2;Sobic.003G062400.2.p;PF00628,PF12165;PTHR12321,PTHR12321:SF37;KOG1632;NONE;NONE;GO:0005515,GO:0042393,GO:0006355;AT5G05610.2;AL1;alfin-like 1;LOC_Os05g07040.1;NA;PHD finger protein, putative, expressed ","Sobic.003G062500.1;37915478;Sobic.003G062500;Sobic.003G062500.1;Sobic.003G062500.1.p;PF14299;PTHR32278,PTHR32278:SF3;NONE;NONE;NONE;NONE;AT4G19840.1;ATPP2-A1,ATPP2A-1,PP2-A1;phloem protein 2-A1;LOC_Os01g06500.1;NA;PHLOEM 2-LIKE A5, putative, expressed ","Sobic.003G062500.2;37915479;Sobic.003G062500;Sobic.003G062500.2;Sobic.003G062500.2.p;PF14299;PTHR32278,PTHR32278:SF3;NONE;NONE;NONE;NONE;AT4G19840.1;ATPP2-A1,ATPP2A-1,PP2-A1;phloem protein 2-A1;LOC_Os01g06500.2;NA;PHLOEM 2-LIKE A5, putative, expressed ","Sobic.003G062600.1;37915638;Sobic.003G062600;Sobic.003G062600.1;Sobic.003G062600.1.p;PF00201;PTHR11926,PTHR11926:SF167;NONE;NONE;NONE;GO:0016758,GO:0008152;AT4G15480.1;UGT84A1;UDP-Glycosyltransferase superfamily protein;LOC_Os02g09510.1;NA;limonoid UDP-glucosyltransferase, putative, expressed ", , , , , , , , , 
GFSSContig19372_585,"Sobic.008G038200.1;37927372;Sobic.008G038200;Sobic.008G038200.1;Sobic.008G038200.1.p;PF13540,PF07714;PTHR27003,PTHR27003:SF72;KOG1187;2.7.11.1;NONE;GO:0006468,GO:0004672;AT3G59420.1;ACR4,CR4;crinkly4;LOC_Os03g43670.1;NA;TKL_IRAK_CR4L.1 - The CR4L subfamily has homology with Crinkly4, expressed ","Sobic.008G038300.1;37926112;Sobic.008G038300;Sobic.008G038300.1;Sobic.008G038300.1.p;PF05419;PTHR34800,PTHR34800:SF1;NONE;NONE;NONE;NONE;AT3G59400.1;GUN4;enzyme binding_tetrapyrrole binding;LOC_Os11g16550.1;NA;uncharacterized protein ycf53, putative, expressed ",Sobic.008G038400.1;37926714;Sobic.008G038400;Sobic.008G038400.1;Sobic.008G038400.1.p;PF10218;PTHR13481;KOG3136;NONE;NONE;NONE;AT3G59390.1;NONE;NONE;LOC_Os11g16560.1;NA;expressed protein , , , , , , , , , , , , 
GFSSContig4757_256,"Sobic.007G219200.3;37935788;Sobic.007G219200;Sobic.007G219200.3;Sobic.007G219200.3.p;PF02990;PTHR10766,PTHR10766:SF44;NONE;NONE;K17086;GO:0016021;AT4G12650.1;NONE;Endomembrane protein 70 protein family;LOC_Os08g38820.2;NA;transmembrane 9 superfamily member, putative, expressed ","Sobic.007G219400.1;37934566;Sobic.007G219400;Sobic.007G219400.1;Sobic.007G219400.1.p;NONE;PTHR33287,PTHR33287:SF3;NONE;NONE;NONE;NONE;AT5G56120.1;NONE;NONE;LOC_Os08g38790.1;NA;expressed protein ","Sobic.007G219300.2;37936081;Sobic.007G219300;Sobic.007G219300.2;Sobic.007G219300.2.p;PF03181;PTHR31236,PTHR31236:SF10;NONE;NONE;NONE;NONE;AT5G25610.1;ATRD22,RD22;BURP domain-containing protein;LOC_Os08g38810.1;NA;BURP domain containing protein, expressed ","Sobic.007G219500.1;37936322;Sobic.007G219500;Sobic.007G219500.1;Sobic.007G219500.1.p;PF00808;PTHR10252,PTHR10252:SF46;NONE;NONE;NONE;NONE;AT1G56170.1;ATHAP5B,HAP5B,NF-YC2;nuclear factor Y, subunit C2;LOC_Os08g38780.1;NA;core histone H2A/H2B/H3/H4, putative, expressed ", , , , , , , , , , , 
NsiI.TP1005,"Sobic.008G148500.1;37927921;Sobic.008G148500;Sobic.008G148500.1;Sobic.008G148500.1.p;NONE;PTHR14237,PTHR14237:SF24;NONE;2.8.1.9;NONE;NONE;AT2G23520.1;NONE;Pyridoxal phosphate (PLP)-dependent transferases superfamily protein;LOC_Os12g40010.2;NA;expressed protein ","Sobic.008G148600.2;37926759;Sobic.008G148600;Sobic.008G148600.2;Sobic.008G148600.2.p;PF02362;PTHR31391,PTHR31391:SF11;NONE;NONE;NONE;GO:0003677;AT4G33280.1;NONE;AP2/B3-like transcriptional factor family protein;LOC_Os12g40080.1;NA;B3 DNA binding domain containing protein, expressed ","Sobic.008G148700.1;37928826;Sobic.008G148700;Sobic.008G148700.1;Sobic.008G148700.1.p;PF02362;PTHR31391,PTHR31391:SF11;NONE;NONE;NONE;GO:0003677;AT4G33280.1;NONE;AP2/B3-like transcriptional factor family protein;LOC_Os12g40080.1;NA;B3 DNA binding domain containing protein, expressed ", , , , , , , , , , , , 
NsiI.TP101439,"Sobic.003G185700.1;37912838;Sobic.003G185700;Sobic.003G185700.1;Sobic.003G185700.1.p;PF00641;PTHR23111,PTHR23111:SF33;NONE;NONE;NONE;GO:0008270;AT3G15680.1;NONE;Ran BP2/NZF zinc finger-like superfamily protein;LOC_Os01g37460.1;NA;zinc finger family protein, putative, expressed ", , , , , , , , , , , , , , 
NsiI.TP102967,"Sobic.001G079200.1;37939429;Sobic.001G079200;Sobic.001G079200.1;Sobic.001G079200.1.p;PF14531;PTHR24361,PTHR24361:SF389;KOG0198;2.7.11.25;NONE;NONE;AT5G66850.1;MAPKKK5;mitogen-activated protein kinase kinase kinase 5;LOC_Os03g55560.1;NA;STE_MEKK_ste11_MAP3K.15 - STE kinases include homologs to sterile 7, sterile 11 and sterile 20 from yeast, expressed ","Sobic.001G079500.1;37944454;Sobic.001G079500;Sobic.001G079500.1;Sobic.001G079500.1.p;PF13912;PTHR26374;NONE;NONE;NONE;NONE;AT1G27730.1;STZ,ZAT10;salt tolerance zinc finger;LOC_Os03g55540.1;NA;ZOS3-18 - C2H2 zinc finger protein, expressed ","Sobic.001G079300.1;37939817;Sobic.001G079300;Sobic.001G079300.1;Sobic.001G079300.1.p;PF00010;PTHR16223,PTHR16223:SF30;NONE;NONE;NONE;GO:0046983;AT2G14760.1;NONE;basic helix-loop-helix (bHLH) DNA-binding superfamily protein;LOC_Os03g55550.1;NA;helix-loop-helix DNA-binding domain containing protein, expressed ","Sobic.001G079600.1;37941447;Sobic.001G079600;Sobic.001G079600.1;Sobic.001G079600.1.p;PF00583;PTHR23091:SF273,PTHR23091;NONE;NONE;NONE;GO:0008080;AT2G23060.1;NONE;Acyl-CoA N-acyltransferases (NAT) superfamily protein;LOC_Os03g55530.1;NA;HLS, putative, expressed ", , , , , , , , , , , 
NsiI.TP104065,"Sobic.001G155400.1;37942803;Sobic.001G155400;Sobic.001G155400.1;Sobic.001G155400.1.p;PF01008;PTHR10233,PTHR10233:SF19;NONE;NONE;K03680;GO:0044237;AT5G38640.1;NONE;NagB/RpiA/CoA transferase-like superfamily protein;LOC_Os03g44310.1;NA;initiation factor 2 subunit family domain containing protein, expressed ", , , , , , , , , , , , , , 
NsiI.TP117758,"Sobic.001G372800.1;37940909;Sobic.001G372800;Sobic.001G372800.1;Sobic.001G372800.1.p;PF01798,PF08156;PTHR10894;NONE;NONE;K14565;NONE;AT3G05060.1;NONE;NOP56-like pre RNA processing ribonucleoprotein;LOC_Os03g22730.1;NA;nucleolar protein NOP5-1, putative, expressed ","Sobic.001G372800.2;37940910;Sobic.001G372800;Sobic.001G372800.2;Sobic.001G372800.2.p;PF01798,PF08156;PTHR10894;NONE;NONE;K14565;NONE;AT3G05060.1;NONE;NOP56-like pre RNA processing ribonucleoprotein;LOC_Os03g22730.1;NA;nucleolar protein NOP5-1, putative, expressed ","Sobic.001G372900.2;37940403;Sobic.001G372900;Sobic.001G372900.2;Sobic.001G372900.2.p;PF00069;PTHR24056,PTHR24056:SF207;KOG0663;2.7.11.22,2.7.11.23;K08819;GO:0006468,GO:0005524,GO:0004672;AT1G54610.2;NONE;Protein kinase superfamily protein;LOC_Os07g47180.2;NA;transposon protein, putative, unclassified, expressed ","Sobic.001G372900.1;37940402;Sobic.001G372900;Sobic.001G372900.1;Sobic.001G372900.1.p;PF00069;PTHR24056,PTHR24056:SF207;NONE;2.7.11.22,2.7.11.23;K08819;GO:0006468,GO:0005524,GO:0004672;AT1G54610.1;NONE;Protein kinase superfamily protein;LOC_Os07g47180.1;NA;transposon protein, putative, unclassified, expressed ","Sobic.001G372900.3;37940401;Sobic.001G372900;Sobic.001G372900.3;Sobic.001G372900.3.p;PF00069;PTHR24056,PTHR24056:SF207;NONE;2.7.11.22,2.7.11.23;K08819;GO:0006468,GO:0005524,GO:0004672;AT1G54610.3;NONE;Protein kinase superfamily protein;LOC_Os07g47180.1;NA;transposon protein, putative, unclassified, expressed ","Sobic.001G373000.1;37943420;Sobic.001G373000;Sobic.001G373000.1;Sobic.001G373000.1.p;PF04097;PTHR11225;NONE;NONE;K14309;GO:0006810,GO:0005643;AT2G41620.1;NONE;Nucleoporin interacting component (Nup93/Nic96-like) family protein;LOC_Os03g22690.1;NA;nucleoporin interacting component, putative, expressed ", , , , , , , , , 
NsiI.TP119595,"Sobic.001G327800.1;37941470;Sobic.001G327800;Sobic.001G327800.1;Sobic.001G327800.1.p;PF00924;PTHR30566,PTHR30566:SF13;NONE;NONE;K16052;GO:0055085,GO:0016020;AT5G10490.1;MSL2;MSCS-like 2;LOC_Os02g45690.1;NA;uncharacterized mscS family protein, putative, expressed ","Sobic.001G327800.2;37941471;Sobic.001G327800;Sobic.001G327800.2;Sobic.001G327800.2.p;PF00924;PTHR30566,PTHR30566:SF13;NONE;NONE;K16052;GO:0055085,GO:0016020;AT5G10490.1;MSL2;MSCS-like 2;LOC_Os02g45690.1;NA;uncharacterized mscS family protein, putative, expressed ","Sobic.001G327800.3;37941472;Sobic.001G327800;Sobic.001G327800.3;Sobic.001G327800.3.p;PF00924;PTHR30566,PTHR30566:SF13;NONE;NONE;NONE;GO:0055085,GO:0016020;AT5G10490.1;MSL2;MSCS-like 2;LOC_Os02g45690.1;NA;uncharacterized mscS family protein, putative, expressed ", , , , , , , , , , , , 
NsiI.TP120901,"Sobic.004G341200.1;37933123;Sobic.004G341200;Sobic.004G341200.1;Sobic.004G341200.1.p;PF00070,PF02852;PTHR22912,PTHR22912:SF106;NONE;1.8.1.7;K00383;GO:0055114,GO:0016491,GO:0045454;AT3G24170.2;ATGR1,GR1;glutathione-disulfide reductase;LOC_Os02g56850.1;NA;glutathione reductase, putative, expressed ","Sobic.004G341200.2;37933124;Sobic.004G341200;Sobic.004G341200.2;Sobic.004G341200.2.p;PF00070,PF02852;PTHR22912,PTHR22912:SF106;NONE;1.8.1.7;K00383;GO:0055114,GO:0016491,GO:0045454;AT3G24170.1;ATGR1,GR1;glutathione-disulfide reductase;LOC_Os02g56850.2;NA;glutathione reductase, putative, expressed ","Sobic.004G341300.2;37933298;Sobic.004G341300;Sobic.004G341300.2;Sobic.004G341300.2.p;PF08541,PF08392;PTHR31561,PTHR31561:SF7;NONE;2.3.1.199;K15397;GO:0016747,GO:0008610,GO:0016020,GO:0006633;AT2G28630.1;KCS12;3-ketoacyl-CoA synthase 12;LOC_Os02g56860.1;NA;3-ketoacyl-CoA synthase, putative, expressed ","Sobic.004G341300.3;37933299;Sobic.004G341300;Sobic.004G341300.3;Sobic.004G341300.3.p;PF08541,PF08392;PTHR31561,PTHR31561:SF7;NONE;2.3.1.199;K15397;GO:0016747,GO:0008610,GO:0016020,GO:0006633;AT2G28630.1;KCS12;3-ketoacyl-CoA synthase 12;LOC_Os02g56860.1;NA;3-ketoacyl-CoA synthase, putative, expressed ", , , , , , , , , , , 
NsiI.TP123778,"Sobic.001G317400.1;37939241;Sobic.001G317400;Sobic.001G317400.1;Sobic.001G317400.1.p;PF13410,PF13417;PTHR11260,PTHR11260:SF200;KOG0406;2.5.1.18;K00799;GO:0005515;AT1G59670.1;ATGSTU15,GSTU15;glutathione S-transferase TAU 15;LOC_Os10g38700.1;NA;glutathione S-transferase, putative, expressed ","Sobic.001G317600.1;37937369;Sobic.001G317600;Sobic.001G317600.1;Sobic.001G317600.1.p;PF00043,PF13417;PTHR11260,PTHR11260:SF232;KOG0406;2.5.1.18;K00799;GO:0005515;AT1G10360.1;ATGSTU18,GST29,GSTU18;glutathione S-transferase TAU 18;LOC_Os10g38160.1;NA;glutathione S-transferase, putative, expressed ","Sobic.001G317700.1;37943557;Sobic.001G317700;Sobic.001G317700.1;Sobic.001G317700.1.p;PF13410,PF13417;PTHR11260,PTHR11260:SF243;KOG0406;2.5.1.18;K00799;GO:0005515;AT1G10370.1;ATGSTU17,ERD9,GST30,GST30B;Glutathione S-transferase family protein;LOC_Os10g38660.1;NA;glutathione S-transferase, putative, expressed ", , , , , , , , , , , , 
NsiI.TP123780,"Sobic.003G223600.1;37912730;Sobic.003G223600;Sobic.003G223600.1;Sobic.003G223600.1.p;PF00201;PTHR11926,PTHR11926:SF255;KOG1192;NONE;K08237;GO:0016758,GO:0008152;AT4G01070.1;GT72B1,UGT72B1;UDP-Glycosyltransferase superfamily protein;LOC_Os01g43280.1;NA;hydroquinone glucosyltransferase, putative, expressed ","Sobic.003G223700.1;37918651;Sobic.003G223700;Sobic.003G223700.1;Sobic.003G223700.1.p;NONE;PTHR11926,PTHR11926:SF255;NONE;2.4.1.218;K08237;GO:0016758,GO:0008152;AT1G01420.1;UGT72B3;UDP-glucosyl transferase 72B3;LOC_Os01g43280.1;NA;hydroquinone glucosyltransferase, putative, expressed ", , , , , , , , , , , , , 
NsiI.TP127048,"Sobic.009G048100.1;37920301;Sobic.009G048100;Sobic.009G048100.1;Sobic.009G048100.1.p;PF01764;PTHR21493,PTHR21493:SF136;NONE;3.1.1.3;NONE;GO:0006629;AT5G67050.1;NONE;alpha/beta-Hydrolases superfamily protein;LOC_Os05g06140.1;NA;lipase, putative, expressed ", , , , , , , , , , , , , , 
NsiI.TP127103,"Sobic.003G221500.1;37918279;Sobic.003G221500;Sobic.003G221500.1;Sobic.003G221500.1.p;NONE;PTHR16684;NONE;NONE;NONE;GO:0000776,GO:0019237,GO:0051382;AT1G15660.1;CENP-C;centromere protein C;LOC_Os01g43050.1;NA;CENP-C1, putative, expressed ","Sobic.003G221700.1;37917791;Sobic.003G221700;Sobic.003G221700.1;Sobic.003G221700.1.p;PF01789;PTHR31407,PTHR31407:SF7;NONE;1.10.3.9;NONE;GO:0019898,GO:0015979,GO:0009654,GO:0009523,GO:0005509;AT5G11450.1;NONE;Mog1/PsbP/DUF1795-like photosystem II reaction center PsbP family protein;LOC_Os01g43070.1;NA;psbP-related thylakoid lumenal protein 4, chloroplast precursor, putative, expressed ","Sobic.003G221700.2;37917792;Sobic.003G221700;Sobic.003G221700.2;Sobic.003G221700.2.p;PF01789;PTHR31407,PTHR31407:SF7;NONE;1.10.3.9;NONE;GO:0019898,GO:0015979,GO:0009654,GO:0009523,GO:0005509;AT5G11450.1;NONE;Mog1/PsbP/DUF1795-like photosystem II reaction center PsbP family protein;LOC_Os01g43070.1;NA;psbP-related thylakoid lumenal protein 4, chloroplast precursor, putative, expressed ","Sobic.003G221700.3;37917793;Sobic.003G221700;Sobic.003G221700.3;Sobic.003G221700.3.p;PF01789;PTHR31407,PTHR31407:SF7;NONE;1.10.3.9;NONE;GO:0019898,GO:0015979,GO:0009654,GO:0009523,GO:0005509;AT5G11450.1;NONE;Mog1/PsbP/DUF1795-like photosystem II reaction center PsbP family protein;LOC_Os01g43070.1;NA;psbP-related thylakoid lumenal protein 4, chloroplast precursor, putative, expressed ",Sobic.003G221600.1;37916646;Sobic.003G221600;Sobic.003G221600.1;Sobic.003G221600.1.p;PF15370;PTHR28674;NONE;NONE;NONE;NONE;AT1G71430.1;NONE;NONE;LOC_Os01g43060.1;NA;expressed protein ,"Sobic.003G221800.1;37913220;Sobic.003G221800;Sobic.003G221800.1;Sobic.003G221800.1.p;PF00248;PTHR11732,PTHR11732:SF253;KOG1575;1.1.1.317;NONE;NONE;AT1G60690.1;NONE;NAD(P)-linked oxidoreductase superfamily protein;LOC_Os01g43090.1;NA;oxidoreductase, aldo/keto reductase family protein, putative, expressed ", , , , , , , , , 
NsiI.TP128678,"Sobic.003G375000.1;37914011;Sobic.003G375000;Sobic.003G375000.1;Sobic.003G375000.1.p;PF00076;PTHR24012,PTHR24012:SF421;KOG0149;NONE;NONE;GO:0003676;AT1G33470.2;NONE;RNA-binding (RRM/RBD/RNP motifs) family protein;LOC_Os01g65550.2;NA;RNA recognition motif containing protein, putative, expressed ","Sobic.003G375200.1;37912476;Sobic.003G375200;Sobic.003G375200.1;Sobic.003G375200.1.p;PF05557;PTHR23168,PTHR23168:SF0;KOG4593;NONE;K06638;GO:0007094;AT5G49880.1;NONE;mitotic checkpoint family protein;LOC_Os01g65580.1;NA;mitotic checkpoint family protein, putative, expressed ","Sobic.003G375300.1;37913234;Sobic.003G375300;Sobic.003G375300.1;Sobic.003G375300.1.p;PF13334,PF01762;PTHR11214,PTHR11214:SF100;KOG2288;2.4.1.134;NONE;GO:0016020,GO:0008378,GO:0006486;AT1G33430.1;NONE;Galactosyltransferase family protein;LOC_Os01g65590.1;NA;galactosyltransferase, putative, expressed ","Sobic.003G375300.2;37913235;Sobic.003G375300;Sobic.003G375300.2;Sobic.003G375300.2.p;PF13334,PF01762;PTHR11214,PTHR11214:SF100;KOG2288;2.4.1.134;NONE;GO:0016020,GO:0008378,GO:0006486;AT1G77810.2;NONE;Galactosyltransferase family protein;LOC_Os01g65590.1;NA;galactosyltransferase, putative, expressed ","Sobic.003G375300.3;37913236;Sobic.003G375300;Sobic.003G375300.3;Sobic.003G375300.3.p;PF13334,PF01762;PTHR11214,PTHR11214:SF100;KOG2288;2.4.1.134;NONE;GO:0016020,GO:0008378,GO:0006486;AT1G77810.2;NONE;Galactosyltransferase family protein;LOC_Os01g65590.1;NA;galactosyltransferase, putative, expressed ","Sobic.003G375100.2;37913410;Sobic.003G375100;Sobic.003G375100.2;Sobic.003G375100.2.p;NONE;PTHR34050:SF1,PTHR34050;NONE;NONE;NONE;NONE;AT1G71310.2;NONE;cobalt ion binding;LOC_Os01g65560.1;NA;snRK1-interacting protein 1, putative, expressed ", , , , , , , , , 
NsiI.TP139027,"Sobic.003G302000.1;37918735;Sobic.003G302000;Sobic.003G302000.1;Sobic.003G302000.1.p;PF14009;PTHR33052,PTHR33052:SF3;NONE;3.4.21.72;NONE;NONE;AT1G29195.1;NONE;NONE;LOC_Os05g07240.1;NA;expressed protein ", , , , , , , , , , , , , , 
NsiI.TP146169,"Sobic.007G090469.1;37934443;Sobic.007G090469;Sobic.007G090469.1;Sobic.007G090469.1.p;PF00432;PTHR11764,PTHR11764:SF14;NONE;NONE;NONE;GO:0003824;AT2G07050.1;CAS1;cycloartenol synthase 1;LOC_Os11g18194.1;NA;cycloartenol synthase, putative, expressed ", , , , , , , , , , , , , , 
NsiI.TP146180,"Sobic.003G246900.1;37915777;Sobic.003G246900;Sobic.003G246900.1;Sobic.003G246900.1.p;PF00249;PTHR24078,PTHR24078:SF177;NONE;NONE;NONE;NONE;AT1G75250.1;ATRL6,RL6,RSM3;RAD-like 6;LOC_Os01g47370.1;NA;MYB family transcription factor, putative, expressed ", , , , , , , , , , , , , , 
NsiI.TP146220,"Sobic.001G162700.1;37938263;Sobic.001G162700;Sobic.001G162700.1;Sobic.001G162700.1.p;PF03372;PTHR11200;KOG0565;3.1.3.56;K01106;NONE;AT1G47510.1;5PTASE11,AT5PTASE11;inositol polyphosphate 5-phosphatase 11;LOC_Os03g42810.1;NA;endonuclease/exonuclease/phosphatase family domain containing protein, expressed ","Sobic.001G162700.2;37938264;Sobic.001G162700;Sobic.001G162700.2;Sobic.001G162700.2.p;PF03372;PTHR11200;KOG0565;3.1.3.56;NONE;NONE;AT1G47510.1;5PTASE11,AT5PTASE11;inositol polyphosphate 5-phosphatase 11;LOC_Os03g42810.1;NA;endonuclease/exonuclease/phosphatase family domain containing protein, expressed ",Sobic.001G162800.1;37942012;Sobic.001G162800;Sobic.001G162800.1;Sobic.001G162800.1.p;NONE;PTHR35999;NONE;NONE;NONE;NONE;AT1G49410.1;TOM6;translocase of the outer mitochondrial membrane 6;LOC_Os03g42799.1;NA;expressed protein ,"Sobic.001G162900.1;37942510;Sobic.001G162900;Sobic.001G162900.1;Sobic.001G162900.1.p;PF01485;PTHR11685,PTHR11685:SF157;KOG1815;6.3.2.19;K11968;GO:0016567,GO:0004842;AT4G34370.1;ARI1,ATARI1;RING/U-box superfamily protein;LOC_Os03g42760.1;NA;zinc finger protein-related, putative, expressed ", , , , , , , , , , , 
NsiI.TP150749,"Sobic.003G380300.1;37913661;Sobic.003G380300;Sobic.003G380300.1;Sobic.003G380300.1.p;PF00034;PTHR11961:SF8,PTHR11961;KOG3453;NONE;K08738;GO:0009055,GO:0020037;AT4G10040.1;CYTC-2;cytochrome c-2;LOC_Os05g34770.1;NA;cytochrome c, putative, expressed ","Sobic.003G380400.1;37918202;Sobic.003G380400;Sobic.003G380400.1;Sobic.003G380400.1.p;NONE;PTHR34116,PTHR34116:SF2;NONE;NONE;NONE;NONE;AT1G57680.1;NONE;NONE;LOC_Os01g66190.1;NA;expressed protein ","Sobic.003G380500.1;37912640;Sobic.003G380500;Sobic.003G380500.1;Sobic.003G380500.1.p;NONE;PTHR31358,PTHR31358:SF7;NONE;NONE;NONE;NONE;AT1G24160.1;NONE;NONE;LOC_Os01g66200.1;NA;expressed protein ","Sobic.003G380500.2;37912641;Sobic.003G380500;Sobic.003G380500.2;Sobic.003G380500.2.p;NONE;PTHR31358,PTHR31358:SF7;NONE;NONE;NONE;NONE;AT1G24160.1;NONE;NONE;LOC_Os01g66200.1;NA;expressed protein ", , , , , , , , , , , 
NsiI.TP152677,"Sobic.003G006833.1;37915013;Sobic.003G006833;Sobic.003G006833.1;Sobic.003G006833.1.p;PF00013,PF10469;PTHR13360,PTHR13360:SF1;KOG2814;3.5.1.1;NONE;GO:0003723;AT3G16230.3;NONE;Predicted eukaryotic LigT;LOC_Os01g13100.1;NA;KH domain containing protein, putative, expressed ", , , , , , , , , , , , , , 
NsiI.TP154359,"Sobic.001G345100.1;37940795;Sobic.001G345100;Sobic.001G345100.1;Sobic.001G345100.1.p;PF01363,PF00118,PF01504;PTHR11353,PTHR11353:SF98;NONE;2.7.1.150;K00921;GO:0046872,GO:0005524,GO:0046488,GO:0016307;AT3G14270.1;FAB1B;phosphatidylinositol-4-phosphate 5-kinase family protein;LOC_Os03g28140.1;NA;1-phosphatidylinositol-4-phosphate 5-kinase/ zinc ion binding protein, putative, expressed ", , , , , , , , , , , , , , 
NsiI.TP159695,"Sobic.006G236700.2;37948341;Sobic.006G236700;Sobic.006G236700.2;Sobic.006G236700.2.p;PF00664,PF00005;PTHR24221,PTHR24221:SF149;NONE;3.6.3.44;NONE;GO:0055085,GO:0042626,GO:0016021,GO:0006810,GO:0005524,GO:0016887;AT3G28860.1;ABCB19,ATABCB19,ATMDR1,ATMDR11,ATPGP19,MDR1,MDR11,PGP19;ATP binding cassette subfamily B19;LOC_Os04g38570.1;NA;multidrug resistance protein, putative, expressed ","Sobic.006G236700.3;37948342;Sobic.006G236700;Sobic.006G236700.3;Sobic.006G236700.3.p;PF00664,PF00005;PTHR24221,PTHR24221:SF149;NONE;3.6.3.44;NONE;GO:0055085,GO:0042626,GO:0016021,GO:0006810,GO:0005524,GO:0016887;AT3G28860.1;ABCB19,ATABCB19,ATMDR1,ATMDR11,ATPGP19,MDR1,MDR11,PGP19;ATP binding cassette subfamily B19;LOC_Os04g38570.1;NA;multidrug resistance protein, putative, expressed ","Sobic.006G236700.1;37948340;Sobic.006G236700;Sobic.006G236700.1;Sobic.006G236700.1.p;PF00005,PF00664;PTHR24221,PTHR24221:SF149;NONE;3.6.3.44;K05658;GO:0016887,GO:0005524,GO:0055085,GO:0042626,GO:0016021,GO:0006810;AT3G28860.1;ABCB19,ATABCB19,ATMDR1,ATMDR11,ATPGP19,MDR1,MDR11,PGP19;ATP binding cassette subfamily B19;LOC_Os04g38570.1;NA;multidrug resistance protein, putative, expressed ", , , , , , , , , , , , 
NsiI.TP166838,"Sobic.003G270500.1;37914172;Sobic.003G270500;Sobic.003G270500.1;Sobic.003G270500.1.p;PF00348;PTHR11525,PTHR11525:SF5;KOG0711;2.5.1.29,2.5.1.10;K00787;GO:0008299;AT5G47770.1;FPS1;farnesyl diphosphate synthase 1;LOC_Os01g50760.1;NA;polyprenyl synthetase, putative, expressed ","Sobic.003G270600.1;37914799;Sobic.003G270600;Sobic.003G270600.1;Sobic.003G270600.1.p;PF01217,PF00928;PTHR10529;NONE;NONE;K12393;NONE;AT1G60780.1;HAP13;Clathrin adaptor complexes medium subunit family protein;LOC_Os01g50770.1;NA;adaptor complexes medium subunit family domain containing protein, expressed ","Sobic.003G270800.1;37915565;Sobic.003G270800;Sobic.003G270800.1;Sobic.003G270800.1.p;PF07690;PTHR23515,PTHR23515:SF3;KOG2533;NONE;K02575;GO:0055085,GO:0016021;AT1G12940.1;ATNRT2.5,NRT2.5;nitrate transporter2.5;LOC_Os01g50820.1;NA;transporter, major facilitator family, putative, expressed ","Sobic.003G270700.1;37914779;Sobic.003G270700;Sobic.003G270700.1;Sobic.003G270700.1.p;PF04043;PTHR31707,PTHR31707:SF51;NONE;NONE;NONE;GO:0004857;AT3G36659.1;NONE;Plant invertase/pectin methylesterase inhibitor superfamily protein;LOC_Os01g50810.1;NA;invertase/pectin methylesterase inhibitor family protein, putative, expressed ", , , , , , , , , , , 
