PstI.TP1231486,"Sobic.002G383500.1;37950091;Sobic.002G383500;Sobic.002G383500.1;Sobic.002G383500.1.p;NONE;PTHR34776,PTHR34776:SF1;NONE;NONE;NONE;NONE;AT1G16770.1;NONE;NONE;LOC_Os02g04780.1;NA;expressed protein ","Sobic.002G383100.1;37951203;Sobic.002G383100;Sobic.002G383100.1;Sobic.002G383100.1.p;PF08263,PF00560,PF00069;PTHR27000,PTHR27000:SF179;KOG1187;2.7.11.1;NONE;GO:0005515,GO:0006468,GO:0005524,GO:0004672;AT5G10020.1;NONE;Leucine-rich receptor-like protein kinase family protein;LOC_Os07g43350.1;NA;expressed protein ","Sobic.002G383300.2;37955400;Sobic.002G383300;Sobic.002G383300.2;Sobic.002G383300.2.p;PF11717,PF01853;PTHR10615,PTHR10615:SF103;KOG2747;2.3.1.48;K11308;GO:0016747,GO:0006355;AT5G64610.1;HAM1;histone acetyltransferase of the MYST family 1;LOC_Os07g43360.1;NA;MYST-like histone acetyltransferase 1, putative, expressed ","Sobic.002G383300.3;37955402;Sobic.002G383300;Sobic.002G383300.3;Sobic.002G383300.3.p;PF11717,PF01853;PTHR10615,PTHR10615:SF103;KOG2747;2.3.1.48;K11308;GO:0016747,GO:0006355;AT5G64610.1;HAM1;histone acetyltransferase of the MYST family 1;LOC_Os07g43360.1;NA;MYST-like histone acetyltransferase 1, putative, expressed ","Sobic.002G383300.1;37955401;Sobic.002G383300;Sobic.002G383300.1;Sobic.002G383300.1.p;PF11717,PF01853;PTHR10615,PTHR10615:SF103;KOG2747;2.3.1.48;K11308;GO:0016747,GO:0006355;AT5G64610.1;HAM1;histone acetyltransferase of the MYST family 1;LOC_Os07g43360.1;NA;MYST-like histone acetyltransferase 1, putative, expressed ","Sobic.002G383400.1;37953861;Sobic.002G383400;Sobic.002G383400.1;Sobic.002G383400.1.p;PF13450;PTHR10742,PTHR10742:SF287;KOG0029;1.3.5.5;NONE;NONE;AT3G09580.1;NONE;FAD/NAD(P)-binding oxidoreductase family protein;LOC_Os07g43370.1;NA;amine oxidase family protein, putative, expressed ", , , , , , , , , 
PstI.TP1236277,"Sobic.003G233500.1;37917295;Sobic.003G233500;Sobic.003G233500.1;Sobic.003G233500.1.p;PF05191,PF00406;PTHR23359,PTHR23359:SF99;KOG3078;2.7.4.3;K00939;GO:0004017,GO:0019205,GO:0006139,GO:0005524;AT5G63400.1;ADK1;adenylate kinase 1;LOC_Os11g20790.1;NA;adenylate kinase, putative, expressed ","Sobic.003G233700.1;37917992;Sobic.003G233700;Sobic.003G233700.1;Sobic.003G233700.1.p;PF09273;PTHR13271:SF9,PTHR13271;KOG1337;2.1.1.127;NONE;NONE;AT5G14260.3;NONE;Rubisco methyltransferase family protein;LOC_Os12g13460.1;NA;SET domain-containing protein, putative, expressed ","Sobic.003G233600.1;37915937;Sobic.003G233600;Sobic.003G233600.1;Sobic.003G233600.1.p;PF02127;PTHR28570,PTHR28570:SF1;NONE;3.4.11.21;K01267;GO:0008270,GO:0006508,GO:0004177;AT5G60160.1;NONE;Zn-dependent exopeptidases superfamily protein;LOC_Os12g13390.1;NA;aspartyl aminopeptidase, putative, expressed ","Sobic.003G233800.1;37915759;Sobic.003G233800;Sobic.003G233800.1;Sobic.003G233800.1.p;PF07714;PTHR27001,PTHR27001:SF36;KOG1187;2.7.11.1;NONE;GO:0006468,GO:0004672;AT1G23540.1;AtPERK12,IGI1;Protein kinase superfamily protein;LOC_Os03g37120.1;NA;retrotransposon protein, putative, unclassified, expressed ", , , , , , , , , , , 
PstI.TP1241952,"Sobic.001G422300.1;37941656;Sobic.001G422300;Sobic.001G422300.1;Sobic.001G422300.1.p;PF00394,PF07732,PF07731;PTHR11709,PTHR11709:SF25;NONE;1.10.3.2;K05909;GO:0055114,GO:0016491,GO:0005507;AT5G60020.1;ATLAC17,LAC17;laccase 17;LOC_Os03g16610.1;NA;laccase precursor protein, putative, expressed ", , , , , , , , , , , , , , 
PstI.TP1248141,"Sobic.001G295100.1;37938916;Sobic.001G295100;Sobic.001G295100.1;Sobic.001G295100.1.p;PF03208;PTHR38519;NONE;NONE;NONE;NONE;AT3G13720.1;PRA1.F3,PRA8;PRA1 (Prenylated rab acceptor) family protein;LOC_Os10g41420.1;NA;expressed protein ","Sobic.001G295200.1;37941992;Sobic.001G295200;Sobic.001G295200.1;Sobic.001G295200.1.p;PF00334;PTHR11349;KOG0888;2.7.4.6;K00940;GO:0006241,GO:0006228,GO:0006183,GO:0006165,GO:0004550;AT4G09320.1;NDPK1;Nucleoside diphosphate kinase family protein;LOC_Os10g41410.2;NA;nucleoside diphosphate kinase, putative, expressed ","Sobic.001G295300.1;37938566;Sobic.001G295300;Sobic.001G295300.1;Sobic.001G295300.1.p;PF01625;PTHR10173,PTHR10173:SF23;KOG1635;1.8.4.11;K07304;GO:0055114,GO:0008113,GO:0030091,GO:0016671,GO:0006979;AT4G25130.1;PMSR4;peptide met sulfoxide reductase 4;LOC_Os10g41400.1;NA;peptide methionine sulfoxide reductase, putative, expressed ","Sobic.001G295400.2;37940048;Sobic.001G295400;Sobic.001G295400.2;Sobic.001G295400.2.p;PF00069;PTHR11909,PTHR11909:SF7;KOG1167;2.7.11.1;NONE;GO:0006468,GO:0005524,GO:0004672;AT4G16970.1;NONE;Protein kinase superfamily protein;LOC_Os10g41390.1;NA;protein kinase domain containing protein, expressed ","Sobic.001G295400.1;37940047;Sobic.001G295400;Sobic.001G295400.1;Sobic.001G295400.1.p;PF00069;PTHR11909,PTHR11909:SF7;KOG1167;2.7.11.1;K02214;GO:0006468,GO:0005524,GO:0004672;AT4G16970.1;NONE;Protein kinase superfamily protein;LOC_Os10g41390.1;NA;protein kinase domain containing protein, expressed ","Sobic.001G295500.1;37940091;Sobic.001G295500;Sobic.001G295500.1;Sobic.001G295500.1.p;NONE;PTHR36051,PTHR36051:SF1;NONE;NONE;NONE;NONE;AT4G17540.1;NONE;NONE;LOC_Os10g41380.1;NA;expressed protein ", , , , , , , , , 
PstI.TP1250993,"Sobic.004G007500.1;37930283;Sobic.004G007500;Sobic.004G007500.1;Sobic.004G007500.1.p;PF00067;PTHR24286,PTHR24286:SF49;NONE;NONE;K10528;GO:0055114,GO:0020037,GO:0016705,GO:0005506;AT4G15440.1;CYP74B2,HPL1;hydroperoxide lyase 1;LOC_Os02g02000.1;NA;cytochrome P450, putative, expressed ","Sobic.004G007400.4;37933095;Sobic.004G007400;Sobic.004G007400.4;Sobic.004G007400.4.p;PF06203;PTHR31717,PTHR31717:SF3;NONE;NONE;NONE;GO:0005515;AT3G21880.1;NONE;B-box type zinc finger protein with CCT domain;LOC_Os02g01990.1;NA;CCT motif family protein, expressed ","Sobic.004G007400.6;37933097;Sobic.004G007400;Sobic.004G007400.6;Sobic.004G007400.6.p;PF06203;PTHR31717,PTHR31717:SF3;NONE;NONE;NONE;GO:0005515;AT3G21880.1;NONE;B-box type zinc finger protein with CCT domain;LOC_Os02g01990.1;NA;CCT motif family protein, expressed ","Sobic.004G007400.7;37933098;Sobic.004G007400;Sobic.004G007400.7;Sobic.004G007400.7.p;PF06203;PTHR31717,PTHR31717:SF3;NONE;NONE;NONE;GO:0005515;AT3G21880.1;NONE;B-box type zinc finger protein with CCT domain;LOC_Os02g01990.1;NA;CCT motif family protein, expressed ","Sobic.004G007400.3;37933094;Sobic.004G007400;Sobic.004G007400.3;Sobic.004G007400.3.p;PF06203;PTHR31717,PTHR31717:SF3;NONE;NONE;NONE;GO:0005515;AT3G21880.1;NONE;B-box type zinc finger protein with CCT domain;LOC_Os02g01990.1;NA;CCT motif family protein, expressed ","Sobic.004G007400.5;37933096;Sobic.004G007400;Sobic.004G007400.5;Sobic.004G007400.5.p;PF06203;PTHR31717,PTHR31717:SF3;NONE;NONE;NONE;GO:0005515;AT3G21880.1;NONE;B-box type zinc finger protein with CCT domain;LOC_Os02g01990.1;NA;CCT motif family protein, expressed ",Sobic.004G007550.1;37930631;Sobic.004G007550;Sobic.004G007550.1;Sobic.004G007550.1.p;NONE;PTHR34892;NONE;NONE;NONE;NONE;AT1G16820.1;NONE;vacuolar ATP synthase catalytic subunit-related / V-ATPase-related / vacuolar proton pump-related;LOC_Os08g02060.1;NA;expressed protein , , , , , , , , 
PstI.TP1251787,Sobic.008G008300.1;37926971;Sobic.008G008300;Sobic.008G008300.1;Sobic.008G008300.1.p;NONE;PTHR31728;NONE;NONE;NONE;NONE;AT3G08780.1;NONE;NONE;LOC_Os07g35600.2;NA;expressed protein ,"Sobic.008G008200.2;37927800;Sobic.008G008200;Sobic.008G008200.2;Sobic.008G008200.2.p;NONE;PTHR10383,PTHR10383:SF23;NONE;NONE;NONE;GO:0016020;AT3G24460.1;NONE;Serinc-domain containing serine and sphingolipid biosynthesis protein;LOC_Os01g08460.1;NA;TMS membrane protein/tumour differentially expressed protein, putative, expressed ", , , , , , , , , , , , , 
PstI.TP1254872,"Sobic.007G137600.1;37934246;Sobic.007G137600;Sobic.007G137600.1;Sobic.007G137600.1.p;PF01073,PF02866;PTHR11540,PTHR11540:SF14;NONE;1.1.1.37;K00026;GO:0055114,GO:0016616,GO:0006694,GO:0003854,GO:0019752;AT3G47520.1;MDH;malate dehydrogenase;LOC_Os08g33720.1;NA;lactate/malate dehydrogenase, putative, expressed ","Sobic.007G137700.1;37936979;Sobic.007G137700;Sobic.007G137700.1;Sobic.007G137700.1.p;PF00445;PTHR11240,PTHR11240:SF19;KOG1642;3.1.27.1;K01166;GO:0033897,GO:0003723;AT2G02990.1;ATRNS1,RNS1;ribonuclease 1;LOC_Os08g33710.1;NA;ribonuclease T2 family domain containing protein, expressed ","Sobic.007G137800.3;37936208;Sobic.007G137800;Sobic.007G137800.3;Sobic.007G137800.3.p;PF14432,PF01535,PF13041;PTHR24015;NONE;NONE;NONE;NONE;AT3G47530.1;NONE;Pentatricopeptide repeat (PPR) superfamily protein;LOC_Os08g33700.1;NA;pentatricopeptide, putative, expressed ","Sobic.007G137800.6;37936212;Sobic.007G137800;Sobic.007G137800.6;Sobic.007G137800.6.p;PF14432,PF01535,PF13041;PTHR24015;NONE;NONE;NONE;NONE;AT3G47530.1;NONE;Pentatricopeptide repeat (PPR) superfamily protein;LOC_Os08g33700.1;NA;pentatricopeptide, putative, expressed ","Sobic.007G137800.5;37936211;Sobic.007G137800;Sobic.007G137800.5;Sobic.007G137800.5.p;PF14432,PF01535,PF13041;PTHR24015;NONE;NONE;NONE;NONE;AT3G47530.1;NONE;Pentatricopeptide repeat (PPR) superfamily protein;LOC_Os08g33700.1;NA;pentatricopeptide, putative, expressed ","Sobic.007G137800.7;37936209;Sobic.007G137800;Sobic.007G137800.7;Sobic.007G137800.7.p;PF14432,PF01535,PF13041;PTHR24015;NONE;NONE;NONE;NONE;AT3G47530.1;NONE;Pentatricopeptide repeat (PPR) superfamily protein;LOC_Os08g33700.1;NA;pentatricopeptide, putative, expressed ","Sobic.007G137800.8;37936210;Sobic.007G137800;Sobic.007G137800.8;Sobic.007G137800.8.p;PF14432,PF01535,PF13041;PTHR24015;NONE;NONE;NONE;NONE;AT3G47530.1;NONE;Pentatricopeptide repeat (PPR) superfamily protein;LOC_Os08g33700.1;NA;pentatricopeptide, putative, expressed ","Sobic.007G137800.4;37936213;Sobic.007G137800;Sobic.007G137800.4;Sobic.007G137800.4.p;PF14432,PF01535,PF13041;PTHR24015;NONE;NONE;NONE;NONE;AT3G47530.1;NONE;Pentatricopeptide repeat (PPR) superfamily protein;LOC_Os08g33700.1;NA;pentatricopeptide, putative, expressed ", , , , , , , 
PstI.TP1260916,"Sobic.001G432800.1;37942213;Sobic.001G432800;Sobic.001G432800.1;Sobic.001G432800.1.p;PF01293;PTHR30031,PTHR30031:SF4;NONE;4.1.1.49,4.1.1.32;K01610;GO:0006094,GO:0005524,GO:0004612;AT4G37870.1;PCK1,PEPCK;phosphoenolpyruvate carboxykinase 1;LOC_Os03g15050.2;NA;phosphoenolpyruvate carboxykinase, putative, expressed ","Sobic.001G432800.2;37942214;Sobic.001G432800;Sobic.001G432800.2;Sobic.001G432800.2.p;PF01293;PTHR30031,PTHR30031:SF4;NONE;4.1.1.49,4.1.1.32;K01610;GO:0006094,GO:0005524,GO:0004612;AT4G37870.1;PCK1,PEPCK;phosphoenolpyruvate carboxykinase 1;LOC_Os03g15050.2;NA;phosphoenolpyruvate carboxykinase, putative, expressed ","Sobic.001G433100.3;37943487;Sobic.001G433100;Sobic.001G433100.3;Sobic.001G433100.3.p;PF11833;PTHR33372,PTHR33372:SF2;NONE;NONE;NONE;NONE;AT3G51140.1;NONE;Protein of unknown function (DUF3353);LOC_Os03g15033.1;NA;expressed protein ","Sobic.001G433100.4;37943488;Sobic.001G433100;Sobic.001G433100.4;Sobic.001G433100.4.p;PF11833;PTHR33372,PTHR33372:SF2;NONE;NONE;NONE;NONE;AT3G51140.1;NONE;Protein of unknown function (DUF3353);LOC_Os03g15033.1;NA;expressed protein ","Sobic.001G433000.1;37940308;Sobic.001G433000;Sobic.001G433000.1;Sobic.001G433000.1.p;PF03101;PTHR31669;NONE;NONE;NONE;GO:0006355;AT5G18960.1;FRS12;FAR1-related sequence 12;LOC_Os03g15040.1;NA;FAR1 family protein, expressed ","Sobic.001G433000.2;37940310;Sobic.001G433000;Sobic.001G433000.2;Sobic.001G433000.2.p;PF03101;PTHR31669;NONE;NONE;NONE;GO:0006355;AT5G18960.1;FRS12;FAR1-related sequence 12;LOC_Os03g15040.1;NA;FAR1 family protein, expressed ","Sobic.001G433000.3;37940309;Sobic.001G433000;Sobic.001G433000.3;Sobic.001G433000.3.p;PF03101;PTHR31669;NONE;NONE;NONE;GO:0006355;AT5G18960.1;FRS12;FAR1-related sequence 12;LOC_Os03g15040.1;NA;FAR1 family protein, expressed ","Sobic.001G433000.4;37940311;Sobic.001G433000;Sobic.001G433000.4;Sobic.001G433000.4.p;PF03101;PTHR31669;NONE;NONE;NONE;GO:0006355;AT5G18960.1;FRS12;FAR1-related sequence 12;LOC_Os03g15040.1;NA;FAR1 family protein, expressed ", , , , , , , 
PstI.TP1268585,"Sobic.001G040100.1;37944507;Sobic.001G040100;Sobic.001G040100.1;Sobic.001G040100.1.p;PF02219;PTHR21091,PTHR21091:SF31;NONE;1.5.1.20;K00297;GO:0055114,GO:0006555,GO:0004489;AT2G44160.1;MTHFR2;methylenetetrahydrofolate reductase 2;LOC_Os03g60090.1;NA;methylenetetrahydrofolate reductase, putative, expressed ","Sobic.001G040000.2;37939351;Sobic.001G040000;Sobic.001G040000.2;Sobic.001G040000.2.p;PF01196;PTHR14413;KOG3280;NONE;K02879;GO:0006412,GO:0005840,GO:0005622,GO:0003735;AT3G54210.1;NONE;Ribosomal protein L17 family protein;LOC_Os03g60100.1;NA;50S ribosomal protein L17, putative, expressed ","Sobic.001G040200.1;37940986;Sobic.001G040200;Sobic.001G040200.1;Sobic.001G040200.1.p;PF02365;PTHR31719,PTHR31719:SF16;NONE;NONE;NONE;GO:0006355,GO:0003677;AT5G08790.1;anac081,ATAF2;NAC (No Apical Meristem) domain transcriptional regulator superfamily protein;LOC_Os03g60080.1;NA;NAC domain-containing protein 67, putative, expressed ", , , , , , , , , , , , 
PstI.TP1274931,"Sobic.007G180450.1;37934925;Sobic.007G180450;Sobic.007G180450.1;Sobic.007G180450.1.p;PF01694,PF00295;PTHR31375,PTHR31375:SF16;NONE;3.2.1.15,3.2.1.67;K01213;GO:0016021,GO:0004252,GO:0005975,GO:0004650;AT5G07250.1;ATRBL3,RBL3;RHOMBOID-like protein 3;LOC_Os06g31270.1;NA;polygalacturonase, putative, expressed ","Sobic.007G180600.1;37935060;Sobic.007G180600;Sobic.007G180600.1;Sobic.007G180600.1.p;PF14555,PF00789;PTHR23322,PTHR23322:SF33;KOG1363;NONE;NONE;GO:0005515;AT4G11740.1;SAY1;Ubiquitin-like superfamily protein;LOC_Os08g43300.1;NA;UBX domain-containing protein, putative, expressed ","Sobic.007G180600.2;37935061;Sobic.007G180600;Sobic.007G180600.2;Sobic.007G180600.2.p;PF00789;PTHR23322,PTHR23322:SF33;KOG1363;NONE;NONE;GO:0005515;AT4G11740.1;SAY1;Ubiquitin-like superfamily protein;LOC_Os08g43300.1;NA;UBX domain-containing protein, putative, expressed ","Sobic.007G180900.1;37934705;Sobic.007G180900;Sobic.007G180900.1;Sobic.007G180900.1.p;PF00240,PF02179;PTHR12329,PTHR12329:SF14;NONE;NONE;NONE;GO:0005515,GO:0051087;AT5G52060.1;ATBAG1,BAG1;BCL-2-associated athanogene 1;LOC_Os09g35630.1;NA;BAG domain-containing protein, putative, expressed ","Sobic.007G180700.1;37936196;Sobic.007G180700;Sobic.007G180700.1;Sobic.007G180700.1.p;NONE;PTHR35501,PTHR35501:SF1;NONE;NONE;NONE;NONE;AT5G52160.1;NONE;Bifunctional inhibitor/lipid-transfer protein/seed storage 2S albumin superfamily protein;LOC_Os08g43290.1;NA;LTPL44 - Protease inhibitor/seed storage/LTP family protein precursor, expressed ", , , , , , , , , , 
PstI.TP1286999,"Sobic.001G122200.1;37939579;Sobic.001G122200;Sobic.001G122200.1;Sobic.001G122200.1.p;PF01753,PF00856;PTHR12197,PTHR12197:SF165;KOG2084;2.1.1.43;K11426;GO:0005515;AT2G17900.1;SDG37;SET domain group 37;LOC_Os03g49730.2;NA;zinc finger protein, putative, expressed ","Sobic.001G122200.3;37939581;Sobic.001G122200;Sobic.001G122200.3;Sobic.001G122200.3.p;PF01753;PTHR12197,PTHR12197:SF165;NONE;2.1.1.43;NONE;NONE;AT2G17900.1;SDG37;SET domain group 37;LOC_Os03g49730.2;NA;zinc finger protein, putative, expressed ","Sobic.001G122200.2;37939580;Sobic.001G122200;Sobic.001G122200.2;Sobic.001G122200.2.p;PF01753,PF00856;PTHR12197,PTHR12197:SF165;KOG2084;2.1.1.43;NONE;GO:0005515;AT2G17900.1;SDG37;SET domain group 37;LOC_Os03g49730.2;NA;zinc finger protein, putative, expressed ","Sobic.001G122100.3;37944199;Sobic.001G122100;Sobic.001G122100.3;Sobic.001G122100.3.p;PF07714;PTHR22974,PTHR22974:SF21;KOG0198;2.7.12.2;K08866;GO:0006468,GO:0004672,GO:0051304,GO:0007093,GO:0004712;AT1G77720.1;PPK1;putative protein kinase 1;LOC_Os03g49750.1;NA;protein kinase family protein, putative, expressed ","Sobic.001G122100.4;37944201;Sobic.001G122100;Sobic.001G122100.4;Sobic.001G122100.4.p;PF07714;PTHR22974,PTHR22974:SF21;KOG0581;2.7.12.2;NONE;GO:0006468,GO:0004672,GO:0051304,GO:0007093,GO:0004712;AT1G77720.1;PPK1;putative protein kinase 1;LOC_Os03g49750.1;NA;protein kinase family protein, putative, expressed ","Sobic.001G122100.5;37944202;Sobic.001G122100;Sobic.001G122100.5;Sobic.001G122100.5.p;PF07714;PTHR22974,PTHR22974:SF21;KOG0581;2.7.12.2;NONE;GO:0006468,GO:0004672,GO:0051304,GO:0007093,GO:0004712;AT1G77720.1;PPK1;putative protein kinase 1;LOC_Os03g49750.1;NA;protein kinase family protein, putative, expressed ","Sobic.001G122100.1;37944198;Sobic.001G122100;Sobic.001G122100.1;Sobic.001G122100.1.p;PF07714;PTHR22974,PTHR22974:SF21;KOG0198;2.7.12.2;K08866;GO:0006468,GO:0004672,GO:0051304,GO:0007093,GO:0004712;AT1G77720.1;PPK1;putative protein kinase 1;LOC_Os03g49750.1;NA;protein kinase family protein, putative, expressed ","Sobic.001G122100.2;37944200;Sobic.001G122100;Sobic.001G122100.2;Sobic.001G122100.2.p;PF07714;PTHR22974,PTHR22974:SF21;KOG0198;2.7.12.2;K08866;GO:0006468,GO:0004672,GO:0051304,GO:0007093,GO:0004712;AT1G77720.1;PPK1;putative protein kinase 1;LOC_Os03g49750.1;NA;protein kinase family protein, putative, expressed ","Sobic.001G122300.1;37942545;Sobic.001G122300;Sobic.001G122300.1;Sobic.001G122300.1.p;PF04755;PTHR31906,PTHR31906:SF14;NONE;NONE;NONE;NONE;AT3G26070.1;NONE;Plastid-lipid associated protein PAP / fibrillin family protein;LOC_Os03g49720.1;NA;PAP fibrillin family domain containing protein, expressed ","Sobic.001G122300.2;37942546;Sobic.001G122300;Sobic.001G122300.2;Sobic.001G122300.2.p;PF04755;PTHR31906,PTHR31906:SF14;NONE;NONE;NONE;NONE;AT3G26070.1;NONE;Plastid-lipid associated protein PAP / fibrillin family protein;LOC_Os03g49720.1;NA;PAP fibrillin family domain containing protein, expressed ","Sobic.001G122400.1;37941029;Sobic.001G122400;Sobic.001G122400.1;Sobic.001G122400.1.p;PF00416;PTHR10871;KOG3311;NONE;K02952;GO:0006412,GO:0005840,GO:0005622,GO:0003735,GO:0003723;AT5G14320.1;NONE;Ribosomal protein S13/S18 family;LOC_Os03g49710.1;NA;ribosomal protein S13p/S18e, putative, expressed ", , , , 
PstI.TP1289837,"Sobic.003G141100.1;37917171;Sobic.003G141100;Sobic.003G141100.1;Sobic.003G141100.1.p;PF00814;PTHR11735,PTHR11735:SF12;KOG2707;2.6.99.4;K01409;NONE;AT2G45270.1;GCP1;glycoprotease 1;LOC_Os12g29990.1;NA;O-sialoglycoprotein endopeptidase, putative, expressed ","Sobic.003G141100.2;37917172;Sobic.003G141100;Sobic.003G141100.2;Sobic.003G141100.2.p;PF00814;PTHR11735,PTHR11735:SF12;NONE;2.6.99.4;NONE;NONE;AT2G45270.1;GCP1;glycoprotease 1;LOC_Os12g29990.2;NA;O-sialoglycoprotein endopeptidase, putative, expressed ","Sobic.003G141200.2;37913090;Sobic.003G141200;Sobic.003G141200.2;Sobic.003G141200.2.p;PF08263,PF00560,PF13855,PF00069;PTHR27000,PTHR27000:SF148;KOG1187;2.7.11.1;K13415;GO:0005515,GO:0006468,GO:0005524,GO:0004672;AT4G39400.1;ATBRI1,BIN1,BRI1,CBB2,DWF2;Leucine-rich receptor-like protein kinase family protein;LOC_Os01g52050.1;NA;systemin receptor SR160 precursor, putative, expressed ", , , , , , , , , , , , 
PstI.TP1295242,"Sobic.001G429200.1;37940557;Sobic.001G429200;Sobic.001G429200.1;Sobic.001G429200.1.p;PF00004;PTHR12172,PTHR12172:SF1;NONE;NONE;NONE;GO:0005524,GO:0007049,GO:0006281,GO:0005634;AT1G77620.1;NONE;P-loop containing nucleoside triphosphate hydrolases superfamily protein;LOC_Os03g15580.1;NA;AT hook motif family protein, expressed ","Sobic.001G429200.2;37940558;Sobic.001G429200;Sobic.001G429200.2;Sobic.001G429200.2.p;PF00004;PTHR12172,PTHR12172:SF1;NONE;NONE;NONE;GO:0005524,GO:0007049,GO:0006281,GO:0005634;AT1G77620.1;NONE;P-loop containing nucleoside triphosphate hydrolases superfamily protein;LOC_Os03g15580.1;NA;AT hook motif family protein, expressed ","Sobic.001G429200.3;37940559;Sobic.001G429200;Sobic.001G429200.3;Sobic.001G429200.3.p;PF00004;PTHR12172,PTHR12172:SF1;NONE;NONE;NONE;GO:0005524,GO:0007049,GO:0006281,GO:0005634;AT1G77620.1;NONE;P-loop containing nucleoside triphosphate hydrolases superfamily protein;LOC_Os03g15580.1;NA;AT hook motif family protein, expressed ","Sobic.001G429200.4;37940560;Sobic.001G429200;Sobic.001G429200.4;Sobic.001G429200.4.p;PF00004;PTHR12172,PTHR12172:SF1;NONE;NONE;NONE;GO:0005524,GO:0007049,GO:0006281,GO:0005634;AT1G77620.1;NONE;P-loop containing nucleoside triphosphate hydrolases superfamily protein;LOC_Os03g15580.1;NA;AT hook motif family protein, expressed ","Sobic.001G429200.5;37940561;Sobic.001G429200;Sobic.001G429200.5;Sobic.001G429200.5.p;PF00004;PTHR12172,PTHR12172:SF1;NONE;NONE;NONE;GO:0005524,GO:0007049,GO:0006281,GO:0005634;AT1G77620.1;NONE;P-loop containing nucleoside triphosphate hydrolases superfamily protein;LOC_Os03g15580.1;NA;AT hook motif family protein, expressed ", , , , , , , , , , 
PstI.TP131472,"Sobic.001G096300.1;37940159;Sobic.001G096300;Sobic.001G096300.1;Sobic.001G096300.1.p;PF01916;PTHR11703;NONE;2.5.1.46;K00809;GO:0008612;AT5G05920.1;DHS,EDA22;deoxyhypusine synthase;LOC_Os03g52970.2;NA;deoxyhypusine synthase, putative, expressed ","Sobic.001G096400.1;37939745;Sobic.001G096400;Sobic.001G096400.1;Sobic.001G096400.1.p;PF14009;PTHR33052,PTHR33052:SF27;NONE;NONE;NONE;NONE;AT4G37240.1;NONE;NONE;LOC_Os03g52940.1;NA;expressed protein ", , , , , , , , , , , , , 
PstI.TP133700,"Sobic.002G187200.1;37950884;Sobic.002G187200;Sobic.002G187200.1;Sobic.002G187200.1.p;PF14416,PF13839;PTHR32285,PTHR32285:SF57;NONE;NONE;NONE;NONE;AT1G70230.1;TBL27;TRICHOME BIREFRINGENCE-LIKE 27;LOC_Os09g20850.1;NA;expressed protein ","Sobic.002G187300.1;37953342;Sobic.002G187300;Sobic.002G187300.1;Sobic.002G187300.1.p;NONE;PTHR36039,PTHR36039:SF2;NONE;NONE;NONE;NONE;AT5G40190.1;NONE;RNA ligase/cyclic nucleotide phosphodiesterase family protein;LOC_Os09g20860.1;NA;calmodulin-binding protein, putative, expressed ","Sobic.002G187300.2;37953343;Sobic.002G187300;Sobic.002G187300.2;Sobic.002G187300.2.p;NONE;PTHR36039,PTHR36039:SF2;NONE;NONE;NONE;NONE;AT5G40190.1;NONE;RNA ligase/cyclic nucleotide phosphodiesterase family protein;LOC_Os09g20860.1;NA;calmodulin-binding protein, putative, expressed ","Sobic.002G187400.1;37953806;Sobic.002G187400;Sobic.002G187400.1;Sobic.002G187400.1.p;PF00069;PTHR27001,PTHR27001:SF150;KOG1187;2.7.11.1;K04733;GO:0006468,GO:0005524,GO:0004672;AT1G24030.2;NONE;Protein kinase superfamily protein;LOC_Os09g20880.2;NA;serine/threonine-protein kinase, putative, expressed ","Sobic.002G187400.2;37953807;Sobic.002G187400;Sobic.002G187400.2;Sobic.002G187400.2.p;PF00069;PTHR27001,PTHR27001:SF150;KOG1187;2.7.11.1;K04733;GO:0006468,GO:0005524,GO:0004672;AT1G24030.2;NONE;Protein kinase superfamily protein;LOC_Os09g20880.2;NA;serine/threonine-protein kinase, putative, expressed ","Sobic.002G187400.3;37953808;Sobic.002G187400;Sobic.002G187400.3;Sobic.002G187400.3.p;PF00069;PTHR27001,PTHR27001:SF150;KOG1187;2.7.11.1;K04733;GO:0006468,GO:0005524,GO:0004672;AT1G24030.2;NONE;Protein kinase superfamily protein;LOC_Os09g20880.1;NA;serine/threonine-protein kinase, putative, expressed ", , , , , , , , , 
PstI.TP134743,"Sobic.001G460800.1;37944311;Sobic.001G460800;Sobic.001G460800.1;Sobic.001G460800.1.p;PF01909;PTHR23092,PTHR23092:SF19;NONE;2.7.7.19;NONE;GO:0016779;AT3G61690.1;NONE;nucleotidyltransferases;LOC_Os03g11240.1;NA;nucleotidyltransferase, putative, expressed ","Sobic.001G461000.1;37939371;Sobic.001G461000;Sobic.001G461000.1;Sobic.001G461000.1.p;NONE;PTHR35098,PTHR35098:SF1;NONE;NONE;NONE;NONE;AT2G03440.1;ATNRP1,NRP1;nodulin-related protein 1;LOC_Os03g11220.1;NA;keratin, type I cytoskeletal 9, putative, expressed ",Sobic.001G460900.2;37940223;Sobic.001G460900;Sobic.001G460900.2;Sobic.001G460900.2.p;NONE;PTHR36730;NONE;NONE;NONE;NONE;AT2G03420.1;NONE;NONE;LOC_Os03g11230.1;NA;expressed protein ,"Sobic.001G461101.1;37939482;Sobic.001G461101;Sobic.001G461101.1;Sobic.001G461101.1.p;NONE;PTHR16007,PTHR16007:SF29;NONE;NONE;NONE;NONE;AT1G55230.1;NONE;Family of unknown function (DUF716) ;LOC_Os09g27260.1;NA;plant viral response family protein, putative, expressed ","Sobic.001G461200.1;37945020;Sobic.001G461200;Sobic.001G461200.1;Sobic.001G461200.1.p;PF04398;PTHR31676,PTHR31676:SF5;NONE;NONE;NONE;NONE;AT2G03350.1;NONE;Protein of unknown function, DUF538;LOC_Os03g11210.1;NA;DUF538 domain containing protein, putative, expressed ", , , , , , , , , , 
PstI.TP13629,"Sobic.002G394800.1;37954010;Sobic.002G394800;Sobic.002G394800.1;Sobic.002G394800.1.p;PF02201;PTHR13844,PTHR13844:SF13;KOG2570;NONE;K11650;GO:0005515;AT5G14170.1;CHC1;SWIB/MDM2 domain superfamily protein;LOC_Os04g31320.1;NA;SWIB/MDM2 domain containing protein, expressed ","Sobic.002G394900.1;37950352;Sobic.002G394900;Sobic.002G394900.1;Sobic.002G394900.1.p;PF12695;PTHR23024,PTHR23024:SF133;KOG1515;3.1.1.1;NONE;NONE;AT5G23530.1;AtCXE18,CXE18;carboxyesterase 18;LOC_Os07g44860.1;NA;gibberellin receptor GID1L2, putative, expressed ","Sobic.002G395000.1;37955251;Sobic.002G395000;Sobic.002G395000.1;Sobic.002G395000.1.p;PF00132;PTHR13061,PTHR13061:SF10;KOG4042;1.6.5.3;NONE;NONE;AT1G47260.1;APFI,GAMMA CA2;gamma carbonic anhydrase 2;LOC_Os12g07220.1;NA;bacterial transferase hexapeptide domain containing protein, expressed ", , , , , , , , , , , , 
PstI.TP136422,"Sobic.003G265600.1;37918780;Sobic.003G265600;Sobic.003G265600.1;Sobic.003G265600.1.p;PF08263,PF13855;PTHR27000,PTHR27000:SF30;NONE;2.7.11.1;NONE;GO:0005515;AT5G20480.1;EFR;EF-TU receptor;LOC_Os11g47290.1;NA;receptor kinase, putative, expressed ","Sobic.003G265701.1;37914239;Sobic.003G265701;Sobic.003G265701.1;Sobic.003G265701.1.p;PF00069;PTHR27000,PTHR27000:SF30;NONE;2.7.11.1;NONE;GO:0006468,GO:0005524,GO:0004672;AT2G24130.1;NONE;Leucine-rich receptor-like protein kinase family protein;LOC_Os01g49910.1;NA;expressed protein ","Sobic.003G265400.1;37916872;Sobic.003G265400;Sobic.003G265400.1;Sobic.003G265400.1.p;PF00291;PTHR10314,PTHR10314:SF121;NONE;4.2.3.1;K01733;NONE;AT4G29840.1;MTO2,TS;Pyridoxal-5\'-phosphate-dependent enzyme family protein;LOC_Os01g49890.1;NA;threonine synthase, chloroplast precursor, putative, expressed ","Sobic.003G265500.1;37915314;Sobic.003G265500;Sobic.003G265500.1;Sobic.003G265500.1.p;PF01195;PTHR17224,PTHR17224:SF5;KOG2255;3.1.1.29;K01056;GO:0004045;AT1G18440.1;NONE;Peptidyl-tRNA hydrolase family protein;LOC_Os01g49900.1;NA;peptidyl-tRNA hydrolase, mitochondrial precursor protein, putative, expressed ", , , , , , , , , , , 
